title,year,description,genre,rating,users_rating,votes,languages,directors,actors,runtime
Tanah Surga... Katanya,2012,"A family lives in the frontier between Indonesia and Malaysia. But his son chooses to live in Malaysia because, in Indonesia, the government is not taking care of people in the frontier and his life in Malaysia is much better.",Drama,,6.9,102,Indonesian,Herwin Novianto,"['Osa Aji Santoso', 'Norman R. Akyuwen', 'Andre Dimas Apri', 'Tissa Biani Azzahra', 'Ence Bagus', 'Gatot Brajamusti', 'Harmonika', 'Frosentiaus Lanyo', 'Deddy Mizwar', 'Astri Nurdin', 'Agus Rahman', 'Ringgo Agus Rahman', 'Anisa Putri Ranidita', 'Andriyanus Riyan', 'Muhammad Rizky']",91 min
Test Pack,2012,"A couple who have been married 7 years set on having children and trying everything from nutrition, fertility calendars, and even sexual positions to reach their goal of having a family.",Comedy,,7.1,134,Indonesian,Monty Tiwa,"['Reza Rahadian', 'Acha Septriasa', 'Renata Kusmanto', 'Meriam Bellina', 'Endhita', 'Muhammad Fachroni', 'Ade Habibie', 'Karissa Habibie', 'Agung Hercules', 'Uli Herdinansyah', 'Gading Marten', 'Jaja Mihardja', 'Ratna Riantiarno', 'Dwi Sasono', 'Fitria Sechan']",105 min
The Witness,2012,"The Witness tells the story about the girl ""Angel Williams"" who is having nightmares about a boy who is commiting suicide. One day Angel is invited by her family to a dinner in their house ...",Drama,,6.3,39,English,Muhammad Yusuf,"['Gwen Zamora', 'Pierre Gruno', 'Agung Saga', 'Kimberly Ryder', 'Marcellino Lafrand', 'Febby Febiola', nan, nan, nan, nan, nan, nan, nan, nan, nan]",
Toilet Blues,2012,Anjany run away from home after she was accused of being involved in an obscence act with her male friends,Drama,,6.2,18,Indonesian,Dirmawan Hatta,"[nan, nan, nan, nan, nan, nan, nan, nan, nan, nan, nan, nan, nan, nan, nan]",87 min
Ummi Aminah,2012,"Ummi Aminah (Nani Widjaja), an ustazah who has thousands of faithful worshipers. wherever he gives the sermon, the mosque is always packed full. In fact, he never asked for payment. Ummi ...",Drama,,7.6,16,Indonesian,Aditya Gumay,"['Nani Widjaja', 'Gatot Brajamusti', 'Aty Cancer', 'Budi Chairul', 'Cathya Kamila', 'Rasyid Karim', 'Ruben Onsu', 'Temmy Rahadi', 'Zee Zee Shahab', 'Revalina S. Temat', 'Elma Theana', 'Genta Windi', 'Satria Wishnu', 'Ali Zainal', nan]",104 min
Vakansi yang Janggal dan Penyakit Lainnya,2012,"Fed up with her daily routine, Ning takes on a new job at a furniture shop. There, she gets the opportunity to get away from her indifferent husband Jarot for a couple of days, having to deliver a sofa with her colleague Mur.",Drama,,4.7,57,Indonesian,Yosep Anggi Noen,"['Muhammad Abe Baasyin', 'Christy Mahanani', 'Joned Suryatmoko', nan, nan, nan, nan, nan, nan, nan, nan, nan, nan, nan, nan]",90 min
Xia aimei,2012,,Drama,,7.6,9,Indonesian,Alyandra,"['Franda', 'Shareefa Daanish', 'Gilang Dirgahari', 'Norman Kamaru', 'Olga Lydia', 'Jasmine Julia Machate', 'Samuel Rizal', 'Ferry Salim', nan, nan, nan, nan, nan, nan, nan]",73 min
13 Cara Memanggil Setan,2011,,Horror,,5.3,19,Indonesian,A. Liong Wong,"['Debby Ayu', 'Five Vi', 'Ki Kusumo', 'H.I.M. Damsyik', 'Fairly Wattimena', 'Ayank Merinda', 'Roy Saputra', 'Diki Al Mubaraq', 'Yoga Hoebnerj', 'Dewi Aida', 'Febriyane', nan, nan, nan, nan]",80 min
Ada Apa dengan Pocong?,2011,"A story about accidental killing of a woman by a herd of men. After the incident, the woman got up from his grave became Pocong and Kuntilanak to avenge his death.",Comedy,,5.2,27,Indonesian,Nayato Fio Nuala,"['Zacky Zimah', 'Joanna Alexandra', 'Dallas Pratama', 'Mpok Atiek', 'Bolot', 'Monique Henry', 'Remon Kruligh', 'Jerry Likumahwa', 'Raymond', 'Tasha Said', nan, nan, nan, nan, nan]",
Akibat Pergaulan Bebas 2,2011,,Drama,,3.2,20,Indonesian,Findo Purwono,"['Lia Aulia', 'Tasya Djerly Emor', 'Keith Foo', 'Rocky Jeff', 'Leylarey Lesesne', 'Aming Sugandhi', nan, nan, nan, nan, nan, nan, nan, nan, nan]",
Anakluh,2011,,Drama,,7.2,6,Indonesian,Edward Sirait,"['Shara Aryo', 'Masayu Clara', 'Rizky Hanggono', 'Suci Winata', nan, nan, nan, nan, nan, nan, nan, nan, nan, nan, nan]",89 min
Arisan! 2,2011,"Eight years have passed since the first ""Arisan!"", many things have changed in the lives of a social elite friendship in Jakarta. Amidst the chaotic sequence of events in Jakarta, a friend of them decide to head to Gili island, Lombok.",Comedy,,6.6,157,Indonesian,Nia Di Nata,"['Cut Mini Theo', 'Tora Sudiro', 'Surya Saputra', 'Aida Nurmala', 'Rachel Maryam Sayidina', 'Atiqah Hasiholan', 'Rio Dewanto', 'Edward Gunawan', 'Adinia Wirasti', 'Keiko Marwan', 'Cynthia Lamusu', 'Isabelle Patrice', 'Jajang C. Noer', 'Lili Harahap', 'Melissa Karim']",119 min
Arwah Goyang Karawang,2011,"Lilis was forced to return to be a dancer in a jaipong dance group called Goyang Karawang. But, Neneng feels threatened by the return of Lilis and she tried to maintain her position. The competition between them became more exciting.",Comedy,,2.9,35,Indonesian,Helfi C.H. Kardit,"['Erlando', 'Ajeng Kraton', 'Julia Perez', 'Dewi Perssik', 'Bembi Zaenal', nan, nan, nan, nan, nan, nan, nan, nan, nan, nan]",90 min
Arwah Kuntilanak Duyung,2011,,Comedy,21+,2.8,35,Indonesian,Yoyok Subagyo,"['Dewi Perssik', 'Saipul Jamil', 'Pretty Asmara', 'Entis Sutisna', 'Afdhal Yusman', nan, nan, nan, nan, nan, nan, nan, nan, nan, nan]",77 min
"Ayah, Mengapa Aku Berbeda?",2011,,Drama,,6.7,25,Indonesian,Findo Purwono,"['Dinda Hauw', 'Surya Saputra', 'Kiki Azhari', 'Fendy Chow', 'Rafi Cinoun', 'Aji Fernandez', 'Khazari', 'Rheina Maryana', 'Rima Melati', 'Indra Sinaga', nan, nan, nan, nan, nan]",99 min
Badai di Ujung Negeri,2011,Very good film . i love it,Adventure,,7.6,37,Indonesian,Agung Sentausa,"['Adrian Alim', 'Dedy Murphy Avivu', 'Edo Borne', 'H. Jojon', 'Ida Leman', 'Priady Muzy', 'Rabzki Muzy', 'Arifin Putra', 'Astrid Tiar', nan, nan, nan, nan, nan, nan]",
Baik-Baik Sayang,2011,,Drama,,6.7,11,Indonesian,Somad Sutedja,"['Wali Band', 'Intan Nuraini', 'Arumy Bachsin', 'Sulis', 'Dennis Adhiswara', 'Cecep Reza', 'Alicia Djohar', 'Anang Hermansyah', 'Didi Petet', 'Syahrini', nan, nan, nan, nan, nan]",95 min
Batas,2011,,Drama,,7.5,26,Indonesian,Rudy Soedjarwo,"['Marcella Zalianty', 'Marcell Domits', 'Arifin Putra', 'Jajang C. Noer', 'Ardina Rasti', 'Piet Pagau', 'Otig Pakis', 'Tetty Liz Indriati', 'Gabriel Armando', 'Alifyandra', nan, nan, nan, nan, nan]",
Belkibolang,2011,"Turithrepe could be the translation of Belkibolang, a contraction of 'Belok kiri boleh langsung' ('Turning right through red permitted'). An exception to the rule. Nine young Indonesian ...",Drama,,5.7,18,Indonesian,Edwin,"['Alexa', 'Deddy Mahendra Desta', 'Panji Rahadi', 'Dwi Sasono', 'Sapto Soetardjo', 'Marsha Timothy', 'Vindy', nan, nan, nan, nan, nan, nan, nan, nan]",87 min
Bukan Pocong Biasa,2011,,Comedy,,5.4,30,Indonesian,Nayato Fio Nuala,"['Zacky Zimah', 'Yoga Arizona', 'Mpok Atiek', 'Ronald Gustav', 'Irene Justine', 'Soraya Larasati', 'Mucle', 'Randy Pangalila', 'Malih Tongtong', nan, nan, nan, nan, nan, nan]",80 min
Catatan (Harian) Si Boy,2011,"Satrio (Ario Bayu) and Natasha (Carissa Puteri) met in an incident. Satrio who is interested in Natasha decides to help her to find the owner of the book that was given by her mom, which turns out to be a diary of a man named ""Boy"".",Action,,6.8,125,Indonesian,Putrama Tuta,"['Ario Bayu', 'Onky Alexander', 'Abimana Aryasatya', 'Tara Basro', 'Paul Foster', 'Albert Halim', 'Roy Marten', 'Didi Petet', 'Carissa Putri', 'Melanie Ricardo', 'Poppy Sovia', nan, nan, nan, nan]",96 min
Cewek Gokil,2011,,Comedy,,5.9,13,Indonesian,Rizal Mantovani,"['Irina Björklund', 'Enditha Bonacelli', 'Pong Harjatmo', 'Syailendra Soepomo', 'Velove Vexia', nan, nan, nan, nan, nan, nan, nan, nan, nan, nan]",
Cewek Saweran,2011,,Drama,,5.0,7,Indonesian,Eddie Cahyono,"['Juwita Bahar', 'Djaduk Ferianto', 'Kriss Hatta', 'Harry Izwan', 'Marwoto', 'Dyah Arum Retnowati', nan, nan, nan, nan, nan, nan, nan, nan, nan]",84 min
Cowok Bikin Pusing,2011,,Drama,,4.8,13,Indonesian,Winalda E.,"['Alex Abad', 'Laudya Cynthia Bella', 'Marcel Chandrawinata', 'Julie Estelle', 'Nino Fernandez', 'Marissa Nasution', 'Aming Sugandhi', nan, nan, nan, nan, nan, nan, nan, nan]",86 min
Dedemit Gunung Kidul,2011,,Horror,,3.7,18,Indonesian,Yoyok Subagyo,"['Uli Auliani', 'Tasa Rudman', 'Ammy Tawaqal', 'Afdhal Yusman', nan, nan, nan, nan, nan, nan, nan, nan, nan, nan, nan]",90 min
Di Bawah Lindungan Ka'bah,2011,"In West Sumatra in the 1920s, Hamid and Zainab come from families from very different social classes. But it did not stop them fall in love and dream of finding a way for society to accept them, also to make the pilgrimage to Mecca.",Drama,,7.4,92,Indonesian,Hanny Saputra,"['Laudya Cynthia Bella', 'Herjunot Ali', 'Niken Anjani', 'Tarra Budiman', 'Jenny Rachman', 'Widyawati', 'Didi Petet', 'Leroy Osmani', nan, nan, nan, nan, nan, nan, nan]",121 min
Dilema,2011,"Dilemma is an omnibus film, five stories that depict dark side of Jakarta's underbelly. Jakarta's underground world that seldom to talk about, and forgotten by most of the people.",Crime,D,7.2,61,Indonesian,Adilla Dimitri,"['Kenes Andari', 'Abimana Aryasatya', 'Ario Bayu', 'Rangga Djoned', 'Wulan Guritno', 'Roy Marten', 'Jajang C. Noer', 'Tio Pakusadewo', 'Pevita Pearce', 'Reza Rahadian', 'Slamet Rahardjo', 'Ray Sahetapy', 'Lukman Sardi', 'Verdi Solaiman', 'Roy Sungkono']",100 min
Enter the Hamster,2011,"Nineties rock legends Vivian's Hamster, having split up ten years ago under catastrophic circumstances, realise that the time has come to reunite the band. No sooner do they hit the ...",Action,,6.3,7,English,Paul Vorrasi,"['Brett Jones', 'Zuzanna Kamusinski', 'Jess Thomas-Hall', 'Sheree Andersen', 'Aran Bright', 'Christopher Cobban', 'Jo Crozier', 'Peter Jeremijenko', 'Shannon Papera', 'Karen Russell', 'Johancee Theron', 'Michael Underwood', 'Stephen Parr', 'Andy Roberts', 'Tim Kirchler']",103 min
Garuda di Dadaku 2,2011,A star player on a national youth soccer team finds a lot of burden from all directions placed on his young shoulders.,Drama,SU,6.4,104,Indonesian,Rudy Soedjarwo,"['Emir Mahira', 'Aldo Tansani', 'Maudy Koesnaedi', 'Ramzi', 'Rio Dewanto', 'Monica Sayangbati', 'Rendy Khrisna', 'Aliando Syarief', 'Mayo Ramzi Fuhaira', 'Miguel Thomas', 'Joshua Pandelaki', 'Rahmat Ee', 'Agon', 'Dorman Borrisman', 'Riyanto Hasyim']",100 min
Get Married 3,2011,"Mae and Rendy already have children, they decide to become an independent family which is free from their parents and friends who only cause trouble. But after giving birth, Mae experienced 'baby blues' which made her become emotional.",Comedy,,5.5,39,Indonesian,Monty Tiwa,"['Nirina Zubir', 'Fedi Nuril', 'Aming Sugandhi', 'Ringgo Agus Rahman', 'Deddy Mahendra Desta', 'Meriam Bellina', 'Jaja Mihardja', 'Ira Wibowo', 'Ratna Riantiarno', 'Barry Prima', 'Kimberly Ryder', 'Billy W. Polli', 'Subarkah', 'Titi Dwijayati', 'Hanung Bramantyo']",95 min
Hafalan Shalat Delisa,2011,"Delisa lives in a village on the Aceh coast. On December 26, 2004, when Delisa was preparing to take the prayer practice test, suddenly an earthquake and a tsunami hit their village and several other areas in Aceh and Southeast Asia.",Drama,,7.2,98,Indonesian,Soni Gaokasak,"['Chantiq Schagerl', 'Reza Rahadian', 'Nirina Zubir', 'Ghina Salsabila', 'Reska Tania Apriadi', 'Riska Tania Apriadi', 'Billy Boedjanger', 'Raiyan Laksamana', 'Mike Lewis', 'Fathir Muchtar', 'Joe Project P.', 'Kanz Randhawa', 'Tony Taulo', 'Loide Christina Teixeira', 'Teuku Umam']",102 min
Jenglot Pantai Selatan,2011,,Horror,,4.0,66,Indonesian,Rizal Mantovani,"['Gabriella Veronica Arian', 'Debby Ayu', 'Narto Bantul', 'Framly Daniel', 'Celine Evangelista', 'Putri Farmer', 'Febriyanie Ferdzilla', 'Daniel Gan', 'Frans Hambali', 'Anastasiya Kovba', 'Buanergis Muryono', 'Temmy Rahadi', 'Wichita Satari', 'Tata Sivek', 'Zidni Adam Zawas']",78 min
Kalung Jailangkung,2011,,Horror,,5.8,11,Indonesian,Nayato Fio Nuala,"[""Ghea D'Syawal"", 'Reymond Knuliq', 'Djati Kusuma', 'Soraya Larasati', 'Yessa Lona', 'Rozie Mahally', 'Torro Margens', 'Munazat Radittya', 'Erlin Sarintan', 'George Taka', 'Zacky Zimah', nan, nan, nan, nan]",80 min
Kehormatan di Balik Kerudung,2011,,Drama,,6.2,13,Indonesian,Tya Subiakto Satrio,"['Donita', 'Andhika Pratama', 'Ussy Sulistiawaty', nan, nan, nan, nan, nan, nan, nan, nan, nan, nan, nan, nan]",105 min
Kejarlah Jodoh Kau Kutangkap,2011,,Comedy,,6.4,25,Indonesian,Indrayanto Kurniawan,"['Andhika Pratama', 'Donita', 'Lydia Kandou', 'Bertrand Antolin', 'Pretty Asmara', 'Mucle', 'Joe Project P.', 'Polo', 'Juhana Sutisna', nan, nan, nan, nan, nan, nan]",103 min
Kentut,2011,"A regent candidate must undergo medical surgery because her right chest was shot while campaigning. After the operation, she still had to undergo treatment at the hospital, because she had to wait until she farted, a sign of recovery.",Comedy,,4.8,25,Indonesian,Aria Kusumadewa,"['Deddy Mizwar', 'Ira Wibowo', 'Keke Soeryo', 'Cok Simbara', 'Iis Dahlia', 'Rahman Yacob', 'Hengky Tornando', 'Anwar Fuady', 'Medina Kamil', 'Zairin Zain', nan, nan, nan, nan, nan]",90 min
Kepergok Pocong,2011,People who find mystic books get rich quick in graves. But there are some oddities.,Comedy,,4.6,11,Indonesian,Nayato Fio Nuala,"['Azis Gagap', 'Reymond Knuliq', 'Rozie Mahally', 'Nadya Almira', 'Keira Sabhira', 'Albert Putra', 'Anastasya Octaviana', 'Vicky Irawan', nan, nan, nan, nan, nan, nan, nan]",78 min
Keranda Kuntilanak,2011,,Comedy,,3.2,16,Indonesian,Nayato Fio Nuala,"['Zacky Zimah', 'Fiona Fachry', 'Tifany Jane', 'Anastasya Octaviana', 'Yessa Lona', 'Indra Brotolaras', 'Munazat Radittya', 'Stefan William', nan, nan, nan, nan, nan, nan, nan]",83 min
Khalifah,2011,,Drama,,6.6,14,Indonesian,Nurman Hakim,"['Marsha Timothy', 'Indra Herlambang', 'Ben Joshua', 'Titi Rajo Bintang', 'Brohisman', 'Jajang C. Noer', 'Yoga Pratama', 'Dion Wiyoko', nan, nan, nan, nan, nan, nan, nan]",90 min
Kuntilanak Kesurupan,2011,,Comedy,D,2.4,20,Indonesian,Nayato Fio Nuala,"['Irish Bella', 'Sazha Carissa', 'Azis Gagap', 'Violenzia Jeanette', 'Reymond Knuliq', 'Yessa Lona', 'Julia Perez', 'Guntur Triyoga', 'Fero Walandouw', 'Evhi Yuliani', nan, nan, nan, nan, nan]",79 min
Langit Biru,2011,,Drama,,6.6,16,Indonesian,Lasja Fauzia,"['Annisa Pinandita', 'Cody Mcclendon', 'Joko Anwar', 'Ayushita', 'Alice Callista', 'Nathanael Carol', 'Brandon De Angelo', 'Ira Duaty', 'Donna Harun', 'Ary Kirana', 'Patton Otlivio Latupeirissa', 'Hermann Josis Mokalu', 'Baby Natalie', 'Tika Panggabean', 'Jonathan Prasetyo']",93 min
Laut Bercermin,2011,"A girl from the Bajo tribe in Wakatobi district goes to a fortune teller in her area. The fortune teller performed a ritual using a mirror, where the local people believed that with a mirror they could see what they were waiting for.",Drama,,7.1,78,Indonesian,Kamila Andini,"['Atiqah Hasiholan', 'Reza Rahadian', 'Gita Novalista', 'Eko', 'Inal', 'Zainal', 'Kuasi', 'Halwiyah', 'Baharudin', 'Ende', 'La Ode Ahmad Ready Putra', 'Darsono', 'Narsih', 'Selti', 'Warni']",100 min
Lima Elang,2011,"Baron is reluctant to move from Jakarta to Balikpapan. In the new town, he chooses to play with his remote-controlled car, instead of making new friends. Despite his behavior, Baron is ...",Family,,7.1,52,Indonesian,Rudy Soedjarwo,"['David Chalik', 'Omara N. Esteghlal', 'Junior Liem', 'Teuku Rizky Muhammad', 'Christoffer Nelwan', 'Iqbaal Dhiafakhri Ramadhan', 'Monica Sayangbati', 'Bastian Bintang Simbolon', nan, nan, nan, nan, nan, nan, nan]",88 min
Lost in Papua,2011,"In the deep jungle of Papua, Rangga (Edo Borne) and his team is on a mission to explore possible mining opportunities in the area. They do not realize they have entered a restricted area ...",Adventure,,6.5,13,Indonesian,Irham Acho Bahtiar,"['Fanny Fabriana', 'Fauzi Baadila', 'Piet Pagau', 'Didi Petet', 'Edo Borne', 'Petrus Taro Gerze', 'Fahrani', nan, nan, nan, nan, nan, nan, nan, nan]",100 min
Love Story,2011,"Ranti and Galih from two different villages are in love and make plans to marry. But the villagers forbid their love as they believe that if the villages are united by a marriage, the disaster will strike.",Drama,17+,7.3,27,Indonesian,Hanny Saputra,"['Acha Septriasa', 'Irwansyah', 'Henidar Amroe', 'Donny Damara', 'Bella Graceva', 'Maudy Koesnaedi', 'Reza Pahlevi', 'Reza Rahadian', nan, nan, nan, nan, nan, nan, nan]",96 min
Lovely Man,2011,"Cahaya (Raihaanun) travels to Jakarta, Indonesia, to search for her father and discovers that he is a prostitute for men.",Drama,,7.2,208,Indonesian,Teddy Soeriaatmadja,"['Donny Damara', 'Raihaanun Soeriaatmadja', 'Yayu A.W. Unru', 'Ari Syarif', 'Lani Sonda', nan, nan, nan, nan, nan, nan, nan, nan, nan, nan]",76 min
Masih Bukan Cinta Biasa,2011,,Drama,,6.8,19,Indonesian,Benni Setiawan,"['Ferdy Taher', 'Wulan Guritno', 'Olivia Lubis Jensen', 'Axel Andaviar', 'Budi Arab', 'Dalton', 'Mucle', 'Joe Project P.', nan, nan, nan, nan, nan, nan, nan]",98 min
Mati Muda di Pelukan Janda,2011,,Comedy,,2.5,6,Indonesian,Helfi C.H. Kardit,"['M. Ihsan Tarore', 'Ayu Pratiwi', 'Shinta Bachir', 'Alfie Alfandi', 'Stevie Domminique Jollie', 'Joe Project P.', 'Julia Robex', 'Vijey Sadiansyah', nan, nan, nan, nan, nan, nan, nan]",82 min
Milli & Nathan,2011,"Milli and Nathan liked each other since high school in Bandung. They dated. Until Nathan broke the news that he would get married. Milli was shocked, disappointed and angry. She removed ...",Drama,,7.6,37,Indonesian,Hanny Saputra,"['Olivia Lubis Jensen', 'Christ Laurent', 'Sabai Morscheck', 'Chaca Rasidy Ariefiansyah', 'Fendy Chow', 'Frans Tumbuan', 'Minati Atmanegara', 'H.I.M. Damsyik', 'Mario Lawalatta', 'Uwie Jasmine', 'Dave Alexander', 'Dimas Beck', nan, nan, nan]",89 min
Misteri Hantu Selular,2011,A youth group terrorized by the ghost who always come after their phone playing automatically the mysterious ringtone,Horror,,6.2,11,Indonesian,Indra Tirtana,"['Celine Evangelista', 'Boy Hamzah', 'Reynavenzka', 'Permadi Sh', 'Gita Sinaga', 'Guruh Soekarnoputra', 'Umar Syarif', 'Udjie Tongky', nan, nan, nan, nan, nan, nan, nan]",
Mortal Enemies,2011,After making a brotherly bond with a fellow orphan and reunited by tragedy they fight to save Verdy's fiancée and stop the international crime scandal together.,Action,R,6.1,105,English,Asun Mawardi,"['Robin Shou', 'Verdy Bhawanta', 'Yayu A.W. Unru', 'Marcio Fernando Da Silva', 'Andrew Lincoln Suleiman', 'Karina Nadila', 'Andry Ganda Wijaya', nan, nan, nan, nan, nan, nan, nan, nan]",103 min
My Blackberry Girlfriend,2011,,Comedy,,5.2,16,Indonesian,Findo Purwono,"['Emmanuel Akwafo', 'Hardi Fadhillah', 'Keith Foo', 'Luna Maya', 'Fathir Muchtar', nan, nan, nan, nan, nan, nan, nan, nan, nan, nan]",83 min
Oh Tidak..!,2011,,Comedy,,4.7,7,Indonesian,Ardy Octaviand,"['Fathir Muchtar', 'Marsha Timothy', 'Marcella Lumowa', 'Jarwo Kwat', 'Arie Dagienkz', 'Kakek Gilang', 'Nenek Gilang', 'Mbok Ijah', nan, nan, nan, nan, nan, nan, nan]",89 min
Pacar Hantu Perawan,2011,,Comedy,,3.8,39,Indonesian,Yoyok Subagyo,"['Misa Campo', 'Rafi Cinoun', 'Jonathan Frizzy', 'Natha Narita', 'Dewi Perssik', 'Olga Syahputra', 'Vicky Vette', nan, nan, nan, nan, nan, nan, nan, nan]",76 min
Pelet Kuntilanak,2011,,Horror,21+,3.5,11,Indonesian,Nayato Fio Nuala,"['Debby Ayu', 'Cinta Dewi', 'Angie Yulia', 'Billy Davidson', 'Billy As', 'Yudha Putra', 'Aria Bahari', 'Daeng', nan, nan, nan, nan, nan, nan, nan]",
Pelukan Janda Hantu Gerondong,2011,,Horror,,4.0,20,Indonesian,Helfi C.H. Kardit,"['Indah Kalalo', 'Aida Saskia', 'Shidiq Hamidi', 'Adam Jordan', 'Lia Ladysta', 'Angel Lelga', 'Andreano Philip', nan, nan, nan, nan, nan, nan, nan, nan]",
Pengejar Angin,2011,,Drama,,6.8,23,Indonesian,Hanung Bramantyo,"['Giorgino Abraham', 'Wanda Hamidah', 'Agus Kuncoro', 'Siti Helda Meilita', 'Mathias Muchus', 'Lukman Sardi', 'Harta Yudana', 'Qausar Harta Yudana', nan, nan, nan, nan, nan, nan, nan]",101 min
Perempuan² Liar,2011,,Comedy,,6.1,16,Indonesian,Rako Prijanto,"['Maeeva Amin', 'Bedu', 'Rina Diana', 'Ghozali', 'Gary M. Iskak', 'Emmi Lemmu', 'Torro Margens', 'Andries Munzier', 'Dallas Pratama', 'Arief Rivan', 'Tora Sudiro', 'Rusdi Syarif', nan, nan, nan]",81 min
Pocong Kesetanan!,2011,,Comedy,,4.8,20,Indonesian,Nayato Fio Nuala,"['Raffi Ahmad', 'Rina Diana', 'Febriyanie Ferdzilla', 'Azis Gagap', 'Reymond Knuliq', 'Rozie Mahally', 'Ajun Perwira', 'Diah Cempaka Sari', 'Guntur Triyoga', nan, nan, nan, nan, nan, nan]",76 min
Pocong Mandi Goyang Pinggul,2011,The story about a creature in a bed-sheet and a live pelmeni's seller in the cemetery.,Comedy,,1.8,158,Indonesian,Yoyok Subagyo,"['Ucok Baba', 'Annisa Bahar', 'Tata Dado', 'Tatang Gepeng', 'Sasha Grey', 'Sheza Idris', 'Chand Kelvin', 'Baby Margaretha', 'Mpok Nori', 'Andreano Philip', nan, nan, nan, nan, nan]",90 min
Pocong Minta Kawin,2011,,Comedy,,7.1,12,Indonesian,Nayato Fio Nuala,"['Mpok Atiek', 'Bolot', 'Christopher', 'Boy Idrus', 'Dhawan Khai', 'Bobby Maulana', 'Dithra Mierva', 'Vicky Nitinegoro', 'Julia Perez', 'Putri', 'Chika Waode', nan, nan, nan, nan]",84 min
Pocong Ngesot,2011,,Comedy,17+,2.8,17,Indonesian,Nayato Fio Nuala,"['Dhana Gadree', 'Azis Gagap', 'Venilia Agi K.', 'Leylarey Lesesne', 'Rozie Mahally', 'Keira Sabhira', 'Fero Walandouw', nan, nan, nan, nan, nan, nan, nan, nan]",79 min
Poconggg Juga Pocong,2011,"The view of the world in a funny way from the eyes of a ghost called ""Poconggg"".",Comedy,,6.2,39,Indonesian,Nayato Fio Nuala,"['Ajun Perwira', 'Rizna Nyctagina', 'Shapira Indah', 'Rizky Mocil', 'Guntur Triyoga', nan, nan, nan, nan, nan, nan, nan, nan, nan, nan]",78 min
Pupus,2011,,Drama,,7.0,31,Indonesian,Rizal Mantovani,"['Donita', 'Marcel Chandrawinata', 'Ichsan Akbar', 'Kaditha Ayu', 'Arthur Brotolaras', 'Vicky Monica', nan, nan, nan, nan, nan, nan, nan, nan, nan]",99 min
Purple Love,2011,"Together with his best friends, Pasha planned to propose to his girlfriend Lisa. It turns out that Lisa broke their relationship because she chose another man. Pasha now is heartbroken.",Drama,,6.2,13,Indonesian,Guntur Soeharjanto,"['Pasha', 'Nirina Zubir', 'Kirana Larasati', 'Qory Sandioriva', 'Makki', 'Arlonsy Onci Miraldi', 'Enda', 'Rowman', 'Henidar Amroe', 'Djenar Maesa Ayu', 'Imey Liem', 'Pasha', 'Unang', nan, nan]",99 min
Red and White III: Hearts of Freedom,2011,"The third and final film of ""Red and White"" trilogy and set during the Indonesian revolution in 1947-1948, as a band of guerrillas fights for Indonesia's freedom on land, sea, and air against the Dutch empire.",Action,,6.2,131,Indonesian,Conor Allyn,"['Darius Sinathrya', 'T. Rifnu Wikana', 'Donny Alamsyah', 'Rahayu Saraswati', 'Lukman Sardi', 'Astri Nurdin', 'Ranggani Puspandya', 'Nugie', 'Mike Bell', 'Aldy Zulfikar', 'Budi Ros', 'Achmad', 'Aco', 'Adit', 'Nyoman Adiyana']",
Rumah Tanpa Jendela,2011,,Drama,,7.2,56,Indonesian,Aditya Gumay,"['Emir Mahira', 'Dwi Tasya', 'Raffi Ahmad', 'Ingrid Widjanarko', 'Yuni Shara', 'Aswin Fabanyo', 'Alicia Djohar', 'Aty Cancer', 'Varissa Camelia', 'Indra Bekti', 'Maudy Ayunda', 'Billy Davidson', 'Ayu Gumay', 'Ouzan Ruz', 'Jessica Veranda']",100 min
Sajadah Ka'bah,2011,,Action,,6.6,7,Indonesian,Rhoma Irama,"['Rhoma Irama', 'Ruhut Sitompul', 'Ida Iasha', 'Zahwa Aqilah', 'Michella Adlen Ladouceur', 'Leroy Osmani', 'Qomar', 'Ridho Rhoma', nan, nan, nan, nan, nan, nan, nan]",107 min
Sang Penari,2011,"Young teenagers who fall in love live in poverty in their small village in the 1960s. The girl, Srintil, is a dancer blessed with dancing moves that said have a certain magic. The boy, Rasus, leaves the village to join the army force.",Drama,,7.1,243,Indonesian,Ifa Isfansyah,"['Prisia Nasution', 'Oka Antara', 'Slamet Rahardjo', 'Dewi Irawan', 'Lukman Sardi', 'Hendro Djarot', nan, nan, nan, nan, nan, nan, nan, nan, nan]",112 min
Semesta Mendukung,2011,,Drama,,6.9,18,Indonesian,John de Rantau,"['Sheina Abdat', 'Rendy Ahmad', 'Sayef Muhammad Billah', 'Febby Febiola', 'Dinda Hauw', 'Zawawi Imron', 'Angga Putra', 'Helmalia Putri', 'Rangga Raditya', 'Omeyga Rossye', 'Ferry Salim', 'Lukman Sardi', 'Sujiwo Tejo', 'Revalina S. Temat', 'Indro Warkop']",101 min
Serdadu Kumbang,2011,,Drama,,7.2,29,Indonesian,Ari Sihasale,"['Yudi Miftahudin', 'Aji Santosa', 'Fachri Azhari', 'Monica Sayangbati', 'Titi Rajo Bintang', 'Ririn Ekawati', 'Lukman Sardi', 'Asrul Dahlan', 'Leroy Osmani', 'Dorman Borisman', 'Surya Saputra', 'Deden Saedul Bahri', 'Sri Bintang', 'Fanny Fadillah', 'Adinda Fudia Hanamici']",106 min
Setannya Kok Masih Ada,2011,,Comedy,,4.5,13,Indonesian,Muchyar Syamas,"['Deddy Mahendra Desta', 'Zacky Zimah', 'Ardani', 'Deriell Jaqueline', 'Rohaina Mursid', 'Hikmal Abrar Nasution', 'Nisye Ivana Ngantung', 'Novita', 'Simson Rarameha', 'Paramita Sari', 'Wawan Sunaryowan', 'Cecep Supriatna', 'Sutrisna', 'Ramco Sari Tua', 'Indah Kusuma Wardani']",83 min
Skandal,2011,,Drama,,5.0,20,Indonesian,Jose Poernomo,"['Uli Auliani', 'Febriyanie Ferdzilla', 'Gary M. Iskak', 'Mario Lawalatta', 'Mike Lucock', 'Laras Monca', 'Boy Rano', nan, nan, nan, nan, nan, nan, nan, nan]",83 min
Surat Kecil Untuk Tuhan,2011,This movie tells the story of a girl named Gita Sesa Wanda Cantika or also known as Keke who fights deadly cancer called Rhabdomyosarcoma as she is the first Rhabdomyosarcoma patient in Indonesia.,Biography,,6.3,100,Indonesian,Harris Nizam,"['Dwi Andhika', 'Egi John Foreisythe', 'Dinda Hauw', 'Alex Komang', 'Ranty Purnamasari', 'Heri Savalas', 'Esa Septian Pramudha Sigit', nan, nan, nan, nan, nan, nan, nan, nan]",105 min
Suster Keramas 2,2011,"Three motorbike racers, a tour guide, and a Japanese tourist named Sachiko (Sora Aoi) coincidentally meet in a hospital after involved in accidents. As soon as they reach there, they feel strange things happening in the hospital.",Comedy,17+,3.9,53,Indonesian,Findo Purwono,"['Ricky Harun', 'Zidni Adam Zawas', 'Sora Aoi', 'Marcell Darwin', 'Violenzia Jeanette', 'Eva Asmarani', 'Tasya Djerly Emor', nan, nan, nan, nan, nan, nan, nan, nan]",80 min
