title,year,description,genre,rating,users_rating,votes,languages,directors,actors,runtime
The Tarix Jabrix,2008,"Starting from the desire of Cacing, an energetic natural born leader, wants to become a member of The Road Devil, the most brutal and feared Motorcycle Gang in the City of Bandung. But he always fails when undergoing tests or exams.",Comedy,SU,6.7,90,Indonesian,Iqbal Rais,"['Tria Changcut', 'Erick Changcut', 'Qibil Changcut', 'Alda Changcut', 'Dipa Changcut', 'Carissa Putri', 'Francine Roosenda', 'Ario Bayu', 'Sam Bimbo', 'Edi Brokoli', 'Sellen Fernandez', 'Sisca Jessica', 'Iga Mawarni', nan, nan]",95 min
Tiren: Mati Kemaren,2008,"Unable to accept his daughter's sudden and mysterious death, the father intentionally let the child's death shroud still tied during the funeral which make her became free spirit, and take ...",Horror,,3.2,21,Indonesian,Emil G. Hampp,"['Dewi Perssik', 'Baron Hermanto', 'Sarah Azhari', 'Deriell Jaqueline', 'Aldiansyah Taher', 'Renee The', nan, nan, nan, nan, nan, nan, nan, nan, nan]",90 min
Tri Mas Getir,2008,,Comedy,,5.0,22,Indonesian,Rako Prijanto,"['Tora Sudiro', 'Indra Birowo', 'Vincent Ryan Rompies', 'Titi Kamal', 'Emmy Lemu', 'Tino Saroengallo', 'Tino Saroenggallo', 'Cut Mini Theo', 'Robby Tumewu', nan, nan, nan, nan, nan, nan]",97 min
Tulalit,2008,"After observing his strange behavior, wealthy, self-obsessed socialite Meriam is convinced her son Edric is gay. Edric's friend Ry convinces him to frame a photo from a magazine and pretend...",Comedy,,3.1,7,Indonesian,Saptadji,"['Meriam Bellina', 'Edric Chan', 'Shareefa Daanish', 'Robby Tumewu', 'Daus Spano', 'Kiwil', 'Yadi Sembako', 'Budi Anduk', 'Arie K. Untung', 'Pretty Asmara', 'Mario Maulana', 'Harry Rahyan', 'Hendrik Bhibir', 'Murfi Owe', 'Ajier']",93 min
Verses of Love,2008,A man who try to get through a complicated relationship in the Islamic way.,Drama,17+,7.1,981,Indonesian,Hanung Bramantyo,"['Fedi Nuril', 'Rianti Cartwright', 'Carissa Putri', 'Zaskia Adya Mecca', 'Melanie Putria', 'Dennis Adhiswara', 'Oka Antara', 'Surya Saputra', 'Mieke Wijaya', 'Amak Baldjun', 'Marini Burhan', 'Rudy Wowor', 'Leroy Osmani', nan, nan]",130 min
Want More?,2008,,Comedy,,4.9,16,Indonesian,Thomas Nawilis,"['Nadila Ernesta', 'Hardi Fadhillah', 'Ratu Felisha', 'Ferry Irawan', 'Mike Lucock', 'Marissa Nasution', 'Boyke Dian Nugraha', 'Gusti Randa', 'Olga Syahputra', 'Five Vi', nan, nan, nan, nan, nan]",90 min
"XL: Extra Large - Antara Aku, Kau, dan Mak Erot",2008,,Drama,,4.8,34,Indonesian,Monty Tiwa,"['Alex Abbad', 'Jamie Aditya', 'Sentot Gempur', 'Tutie Kirana', 'Erron Lebang', 'Rizky Mocil', 'Barry Prima', 'Francine Roosenda', 'Elmayana Sabriena', 'Sarah Sechan', 'Ingrid Widjanarko', 'T. Rifnu Wikana', nan, nan, nan]",
3 Hari Untuk Selamanya,2007,"The three days trip that changes everything. In that trip they meet many things and discuss about sex, marriage and religion.",Comedy,,7.1,305,Indonesian,Riri Riza,"['Bowie Budianto', 'Tutie Kirana', 'Ringgo Agus Rahman', 'Nicholas Saputra', 'Adinia Wirasti', nan, nan, nan, nan, nan, nan, nan, nan, nan, nan]",104 min
Angkerbatu,2007,A Korean construction company pays with their lives for building in a forbidden forest.,Horror,,4.9,30,Indonesian,Jose Poernomo,"['Mieke Amalia', 'Susilo Badar', 'Yama Carlos', 'Imelda', 'Dan Kim', 'Nuri Maulida', 'Bayu S. Virguna', nan, nan, nan, nan, nan, nan, nan, nan]",
Badai Pasti Berlalu,2007,"The story of a brokenhearted woman who becomes cold and bitter, a medical student who was placing a bet with his pals to win her heart, and an odd guy but had once studied abroad who forces her to marry him in order to protect her family.",Drama,,6.7,33,Indonesian,Teddy Soeriaatmadja,"['Vino G. Bastian', 'Raihaanun Soeriaatmadja', 'Winky Wiryawan', 'Indra Birowo', 'Que Haidar', 'Dewi Irawan', 'Agastya Kandou', 'Slamet Rahardjo', 'Fasha Sandha', 'Davina Veronica', nan, nan, nan, nan, nan]",90 min
Beranak dalam Kubur,2007,"Jessy, Jovan, Titaz and Kalia and Brian are the doctoral students who are make friends. They are doing the observatory for their anatomy task in a hospital. They found a closed and ...",Horror,,3.1,27,Indonesian,Freddy Lingga,"['Dinda Kanyadewi', 'Revand T. Narya', 'Julia Perez', 'Adhitya Putri', nan, nan, nan, nan, nan, nan, nan, nan, nan, nan, nan]",90 min
Bukan Bintang Biasa,2007,"Bella (Laudya Cynthia Bella), Raffi (Raffi Ahmad), Ayu (Ayushita), Dimas (Dimas Beck) and Chelsea (Chelsea Olivia) are college mates in an art academy. At first, Bella was Raffi's ...",,,4.3,46,Indonesian,Lasja Fauzia,"['Raffi Ahmad', 'Ayushita', 'Dimas Beck', 'Laudya Cynthia Bella', 'Chelsea Olivia', nan, nan, nan, nan, nan, nan, nan, nan, nan, nan]",
Dead Time,2007,A jaded cop. A narcoleptic journalist. A nation divided. A Fantasy you'd wish never come true.,Crime,,7.0,875,Indonesian,Joko Anwar,"['Donny Alamsyah', 'Fachry Albar', 'Ario Bayu', 'Fahrani', 'Tipi Jabrik', 'José Rizal Manua', 'August Melasz', 'Arswendi Nasution', 'Shanty', 'Sujiwo Tejo', 'Frans Tumbuan', 'Agung Udijana', nan, nan, nan]",102 min
Enam,2007,Six young filmmakers go to a remote house to make a horror short film. They are warned by the owner that the house has a soul of its own.,Horror,,5.8,12,Indonesian,Stephen Odang,"['Putri Patricia', 'Barry Prima', 'David Saragih', 'Mandala Abadi Shoji', 'Duran Valentino', 'Winnie Yanthi', nan, nan, nan, nan, nan, nan, nan, nan, nan]",97 min
Film Horor,2007,,Comedy,,5.2,32,Indonesian,Toto Hoedi,"['Dwi A.P.', 'Ferdinal Arnaz', 'Maria Eva', 'Andhika Gumilang', 'Ferry Irawan', 'Secha Lauretta', 'Sheila Marcia', 'Terta Mayasari', 'Cut Memey', 'Reza Rahadian', 'Shierly Rushworth', 'Udjie Tongky', 'Angie Virgin', nan, nan]",115 min
Genderuwo,2007,Ghosts haunt the mad novelist who threaten a women who stay alone in a house,Horror,D,1.7,30,Indonesian,K.K. Dheeraj,"['Davina Veronica', 'Robby Shine', 'Indah Kirana', nan, nan, nan, nan, nan, nan, nan, nan, nan, nan, nan, nan]",
Get Married,2007,"Mae (Nirina Zubir) and her friends have big obsessions to become big people but instead, they all end up becoming something that they didn't dream of. Be they frustrated young people who spent days together in a hut on the edge of river.",Comedy,,6.5,216,Indonesian,Hanung Bramantyo,"['Nirina Zubir', 'Meriam Bellina', 'Richard Kevin', 'Iga Mawarni', 'Jaja Mihardja', 'Ringgo Agus Rahman', 'Verdi Solaiman', 'Stanlee', 'Subhan', 'Putri Sukardi', 'Ingrid Widjanarko', nan, nan, nan, nan]",105 min
Hantu,2007,,Horror,,5.8,38,Indonesian,Adrianto Sinaga,"['Dhea Ananda', 'Dwi Andhika', 'Oka Antara', 'Andhika Gumilang', 'Monique Henry', nan, nan, nan, nan, nan, nan, nan, nan, nan, nan]",95 min
Jelangkung 3,2007,"Yodi wanted more than anything to find out if the stories about the curse associated with the horror movie Jelangkung were true. He had heard that if someone watched the movie alone, they ...",Horror,SU,4.7,23,Indonesian,Angga Dwimas Sasongko,"['Mitha Griselda', 'Reza Pahlevi', 'Andrew Roxburgh', nan, nan, nan, nan, nan, nan, nan, nan, nan, nan, nan, nan]",90 min
Kangen,2007,"Two lovebirds separated by fate, and has to deal with a heartbreaking feeling of longing for each other.",Drama,,5.8,14,Indonesian,Nayato Fio Nuala,"['Bunga Citra Lestari', 'Reuben Elishama', 'Reuben E. Hadju', 'Nino Fernandez', 'Uli Herdinansyah', nan, nan, nan, nan, nan, nan, nan, nan, nan, nan]",90 min
Kuntilanak 2,2007,"A young college student has recently moved out of her old, haunted boarding house, escaping from followers of Mangkoedjiwo Sect who seek revenge over the death of Sri Sukmarahimi Mangkoedjiwo.",Horror,,5.7,155,Indonesian,Rizal Mantovani,"['Sutan Amanullah', 'Bella Esperance', 'Julie Estelle', 'Ibnu Jamil', 'Buanergis Muryono', 'Piet Pagau', 'Evan Sanders', 'Cepi Setiawan', 'Lita Soewardi', 'Cindy Valerie', nan, nan, nan, nan, nan]",
Lantai 13,2007,"Luna has just gotten her first job as a secretary for a major company in Jakarta. She's got her own desk, new good friends and a seemingly friendly boss. There's only one problem. Ever ...",Horror,,4.8,35,Indonesian,Helfi C.H. Kardit,"['Widi Mulia', 'Bella Esperance', 'Lucky Hakim', 'Irwansyah', 'Virnie Ismail', 'Tio Pakusadewo', 'Ariyo Wahab', nan, nan, nan, nan, nan, nan, nan, nan]",
Lari dari Blora,2007,,Drama,,5.6,8,Indonesian,Akhlis Suryapati,"['Tina Astari', 'Fadli Fuad', 'Iswar Kelana', 'Octav Kriwil', 'Annika Kuyper', 'Egy Massadiah', 'Andreano Philip', 'Ardina Rasti', 'W.S. Rendra', 'Soultan Saladin', 'Nizar Zulmi', nan, nan, nan, nan]",
Lawang Sewu,2007,"A group of six teenagers find themselves haunted and terrorized by a Kuntilanak when they try to find their missing friend inside Lawang Sewu, a supposedly haunted building in Semarang.",Horror,,5.2,79,Indonesian,Arie Azis,"['Thalita Latief', 'Marcell Darwin', 'Melvin Giovanie', 'Tsania Marwa', 'Salvita Decorte', 'Ronald Gustav', 'Bunga Jelitha', 'Renny Djajoesman', 'Nuri Maulida', 'Yati Pesek', 'August Melasz', 'Chicco Jerikho', nan, nan, nan]",112 min
Legenda Sundel Bolong,2007,"Imah's boss Danapati rapes her. She tries to hide the fact from her husband Imah, but soon strange things start to happen as people are found dead with holes in their backs. People believe it is the work of the ghost Sundel Bolong.",Horror,,5.0,23,Indonesian,Hanung Bramantyo,"['Uli Auliani', 'Baim', 'Jian Batari', 'Tio Pakusadewo', nan, nan, nan, nan, nan, nan, nan, nan, nan, nan, nan]",91 min
Long Road to Heaven,2007,"This film is set in the aftermath of the 2002 Bali bombings. Focusing on three different perspectives, it looks at how these individuals find peace in their lives.",Drama,,6.9,45,English,Enison Sinaro,"['Made Kopi', 'Sarah Treleaven', ""John O'Hare"", 'Madison Evens', 'Jason Paul Robson', 'Mirrah Foulkes', 'Alfredo Font', 'Adityawan Darmawan', 'Salman Aristo', 'Raelee Hill', 'Nyoman Budiyasa S. Sn', 'Alex Komang', 'Clara Yulia', 'Sudibyo Js', 'Hestu Wreda']",120 min
Lotus Requiem,2007,"This is an omnibus film by women directors: Nia Dinata (Love for Share), Upi Avianto (Radit and Jani), Lasja Fauzia Susatyo (Not an Ordinary Star), and one guest director, Fatimah T. Rony. ...",Drama,D,7.5,70,Indonesian,Upi Avianto,"['Fauzi Baadila', 'Susan Bachtiar', 'Otto Djauhari', 'Kirana Larasati', 'Arswendi Nasution', 'Ade Firza Paloh', 'Rieke Dyah Pitaloka', 'Ratna Riantiarno', 'Rachel Maryam Sayidina', 'Sarah Sechan', 'Shanty', 'Tarzan', 'Winky Wiryawan', nan, nan]",105 min
Love Is Cinta,2007,"Ryan (Irwansyah) canceled his departure to America to meet Cinta (Acha Septriasa). But, he died tragically in an accident. However, Ryan is given chance to live once again to confess to Cinta but as someone else named Doni (Raffi Ahmad).",Drama,17+,5.6,132,Indonesian,Hanny Saputra,"['Acha Septriasa', 'Irwansyah', 'Raffi Ahmad', 'Andhika Pratama', 'Juwita Maritsa', 'Tio Pakusadewo', 'Henidar Amroe', 'Unique Priscilla', 'Nirina Zubir', nan, nan, nan, nan, nan, nan]",
Malam Jumat Kliwon,2007,,Horror,17+,2.2,29,Indonesian,Nayato Fio Nuala,"['Daffy Ariaga', 'Abimana Aryasatya', 'Nadiah Hasan', 'Gracia Indri', 'Ben Joshua', 'Debby Kristy', nan, nan, nan, nan, nan, nan, nan, nan, nan]",90 min
Medley,2007,"Medley is a movie about parallel universe and possibilities in life about choices, consequences and relationships. Medley tells a story about one man, who is turning 30 years old in the ...",Drama,,6.4,8,Indonesian,Franklin Darmadi,"['Alexandra Gottardo', 'Alex Komang', 'Hermann Josis Mokalu', 'Rachel Maryam Sayidina', 'Imelda Therinne', nan, nan, nan, nan, nan, nan, nan, nan, nan, nan]",97 min
Mengejar Mas Mas,2007,Because the sun doesn't need to catched.,Comedy,,7.3,45,Indonesian,Rudy Soedjarwo,"['Marcell Anthony', 'Eddie Karsito', 'Roy Marten', 'Shaheila Nafissa', 'Zaldy Nurzaman', 'Dinna Olivia', 'Elmayana Sabriena', 'Dwi Sasono', 'Poppy Sovia', 'Ira Wibowo', nan, nan, nan, nan, nan]",94 min
Miracle: Menantang Maut,2007,Kinar got alphabetic code KITA MATI that indicates the upcoming deaths of herself and everyone with initial in the code,Horror,SU,3.6,14,Indonesian,Helfi C.H. Kardit,"['Abimana Aryasatya', 'Ivy Batuta', 'Nadila Ernesta', 'Lian Firman', 'Andry Ilham', 'Inong', 'Dhitra Marfie', 'Intan Ayu Purnama', 'Keira Sabhira', 'Wisnu Wijaya', nan, nan, nan, nan, nan]",98 min
Naga Bonar Jadi 2,2007,"This movie is a sequel to the 1986 movie ""Naga Bonar"". The story about the relationship between Naga Bonar, a pickpocket who became a self-proclaimed general during Indonesia's war of independence and his only son Bonaga.",Comedy,,7.1,397,Indonesian,Deddy Mizwar,"['Deddy Mizwar', 'Tora Sudiro', 'Wulan Guritno', 'Mike Lucock', 'Uli Herdinansyah', 'Darius Sinathrya', 'Lukman Sardi', 'Emir Alviandri Akram', 'Prio Aljabar', 'Indra Birowo', 'Ghozali', 'Sakurta H. Ginting', 'Nusa Kalimasada', 'Opie Kumis', 'Julian Kunto']",118 min
Pocong 3,2007,,Horror,,5.1,44,Indonesian,Monty Tiwa,"['Francine Roosenda', 'Darius Sinathrya', 'Gary M. Iskak', 'Elmayana Sabriena', 'Rina Hasyim', 'Otig Pakis', 'Ajeng Sardi', nan, nan, nan, nan, nan, nan, nan, nan]",
Pulau Hantu,2007,"Eight teenagers are set to sail for a holiday. However, the yacht has to leave them in a private small island with a single resort. The island keeps a ghostly secret that starts to prey ...",Horror,,3.9,39,Indonesian,Jose Poernomo,"['Ricky Harun', 'Yedihel Luntungan', 'Kartika Ayuningtyas', 'Indri Yanuarti', 'Abdurrahman Arif', 'Ufara Dzikri', 'Bramasto', 'Rini Oktaviani', 'Boy Rano', 'Muthia Nova Syahputri', 'Monica Sayangbati', 'Panca Prakoso', 'Oreffor Coy', nan, nan]",91 min
Quickie Express,2007,"A man struggles for fame and money, until he is offered as a gigolo for Quickie express Company.",Comedy,,6.9,360,Indonesian,Dimas Djayadiningrat,"['Sandra Dewi', 'Reuben Elishama', 'Ria Irawan', 'Melissa Karim', 'Tio Pakusadewo', 'Rudolph Angelo Ratulangi', 'Lukman Sardi', 'Tino Saroengallo', 'Tino Saroenggallo', 'Ira Maya Sopha', 'Tora Sudiro', 'Aming Sugandhi', 'Rudy Wowor', 'Amron Paul Yuwono', nan]",
Roh,2007,,Horror,,4.4,11,Indonesian,Atok Suharto,"['Angel Bella', 'Ryan Delon', 'Zaenal Abidin Domba', 'Irul Luthan', 'Putri Patricia', 'Tabah Penemuan', 'Rini Yuliantini', nan, nan, nan, nan, nan, nan, nan, nan]",
Selamanya,2007,"Aristha (Julie Estelle) met his old lover, Bara (Dimas Seto), at the police station. Bara, who feels guilty because Aristha plunges into the world of drugs, trying desperately to pull ...",Drama,,7.0,45,Indonesian,Ody C. Harahap,"['Masayu Anastasia', 'Julie Estelle', 'Dimas Seto', nan, nan, nan, nan, nan, nan, nan, nan, nan, nan, nan, nan]",
Suster N,2007,"A movie about the famous ghost of the Dutch raised nurse, Norah, who can not walk for having a wounded leg.",Horror,,4.3,27,Indonesian,Viva Westi,"['Atiqah Hasiholan', 'Wulan Guritno', 'Bob Seven', 'Ardina Rasti', 'Henky Solaiman', 'H.I.M. Damsyik', 'Ratna Riantiarno', 'Ade Irawan', 'Titi Qadarsih', 'Mila Karmila', 'Dominique Sanda', 'Jajang C. Noer', 'Lukman Sardi', nan, nan]",
Suster Ngesot,2007,"Vira (18) pretty girl. She is a nurse and have friend named Silla (18) pretty girl, a nurse, sexy. They go from bandung to Jakarta to work as nurses, a job that they got. Silla is been ...",Horror,,4.9,39,Indonesian,Arie Azis,"['Nia Ramadhani', 'Mike Lewis', 'Donita', 'Lia Waode', 'Mastur', 'Arswendi Nasution', 'Jajang C. Noer', nan, nan, nan, nan, nan, nan, nan, nan]",87 min
Tentang Cinta,2007,,Drama,,7.9,54,Indonesian,Soni Gaokasak,"['Vino G. Bastian', 'Hayria Faturrahman', 'Sheila Marcia', 'Fedi Nuril', 'Slamet Rahardjo', nan, nan, nan, nan, nan, nan, nan, nan, nan, nan]",90 min
Terowongan Casablanca,2007,,Horror,,3.9,40,Indonesian,Nanang Istiabudi,"['Donny Arifin', 'Ki Joko Bodo', 'Nino Fernandez', 'Jupiter Fortissimo', 'Titi Qadarsih', 'Ardina Rasti', 'Ray Sahetapy', 'Asha Shara', 'Aldiansyah Taher', 'Five Vi', nan, nan, nan, nan, nan]",
The Butterfly,2007,"Vano (Andhika Pratama), Tia (Poppy Sovia), and Desi (Debby Kristy) has met and become best friends since the beginning of the college. Tia who is boyish becomes really protective toward ...",Drama,,6.4,21,Indonesian,Nayato Fio Nuala,"['Debby Kristy', 'Andhika Pratama', 'Poppy Sovia', nan, nan, nan, nan, nan, nan, nan, nan, nan, nan, nan, nan]",85 min
The Photograph,2007,An escort at a karaoke bar struggles to raise money to send her daughter out of the city to live with her grandmother and settle her debts with her pimp. She moves in with an aging photographer and helps him fulfill his last wishes.,Drama,,6.8,179,Indonesian,Nan Triveni Achnas,"['Kay Tong Lim', 'Shanty', 'Lukman Sardi', 'Indi Barends', nan, nan, nan, nan, nan, nan, nan, nan, nan, nan, nan]",94 min
The Wall,2007,"Film The Wall bercerita tentang pembuatan film di sebuah villa tua yang menakutkan. Sabrina (Nessa Sadin), seorang penulis skenario bergaya gothic mencoba menulis di villa angker tersebut ...",Horror,,4.6,8,Indonesian,Kumar Pareek,"['Rifky Balweel', 'Savira Crith', 'Deriell Jaqueline', 'Defry Padhayangan', 'Nessa Sadin', 'An-Shun Yu', nan, nan, nan, nan, nan, nan, nan, nan, nan]",
9 Naga,2006,"Three friends since childhood earn a living by working as assassins. The more they did, the more they realized that the work did not promise a better future. Suddenly, an event made them change and tried to correct their past mistakes.",Crime,17+,6.5,119,Indonesian,Rudy Soedjarwo,"['Donny Alamsyah', 'Fauzi Baadila', 'Dorman Borisman', 'Ajeng Sardi', 'Lukman Sardi', nan, nan, nan, nan, nan, nan, nan, nan, nan, nan]",104 min
Bangku Kosong,2006,"tells the story of a sacred bench that can not be occupied by anyone from time to time, but a new student girl named Dinda is very curious about what happened in the past, she was ...",Horror,,5.8,49,Indonesian,Helfi C.H. Kardit,"['Adhitya Putri', 'Cathy Sharon', 'Bella Esperance', 'Tities Saputra', 'Zhi F.', 'Nadiah Hasan', 'Tania Hardjosubroto', 'Dewi Sahira', 'Keke Harun', 'Renny Umari', 'Reza Artamevia', 'Nurul Hidayati', 'Annie Anwar', 'Piet Pagau', 'Unique Priscilla']",
Berbagi Suami,2006,This is the story of women those are live in polygamy life. It's about their consequence to accept the status as other wife.,Comedy,17+,7.5,379,Indonesian,Nia Di Nata,"['Jajang C. Noer', 'Shanty', 'Dominique Agisca Diyose', 'El Manik', 'Tio Pakusadewo', 'Lukman Sardi', 'Nungki Kusumastuti', 'Ria Irawan', 'Ira Maya Sopha', 'Winky Wiryawan', 'Rieke Dyah Pitaloka', 'Reuben Elishama', 'Atiqah Hasiholan', 'Janna Karina Sukasah', 'Melissa Karim']",
Betina,2006,,Drama,,7.6,5,Indonesian,Lola Amaria,"['Agastya Kandou', 'Kinaryosih', 'Tutie Kirana', 'Otig Pakis', 'Subur Sukirman', 'Zairin Zain', nan, nan, nan, nan, nan, nan, nan, nan, nan]",70 min
"Denias, Senandung di Atas Awan",2006,A boy from a tribe in inland Papua named Denias struggles to get the proper education for a better life.,Drama,,6.8,150,Indonesian,John de Rantau,"['Albert Fakdawer', 'Ari Sihasale', 'Marcella Zalianty', 'Mathias Muchus', 'Nia Zulkarnaen', 'Michael Jakarimilena', 'Audry Papilaja', 'Pevita Pearce', 'Minus Coneston Karoba', 'Ryan Manobi', 'Chalvin Wanda', 'Yahuda Rumbindi', 'Sonya Baransono', 'Philipus Ramendei Thamo', 'Roni Wabia']",110 min
Ekspedisi Madewa,2006,"Tiro, a geologist is suddenly caught up in a quest for a powerful ancient artefact when he accidentally find a missing artefact from ancient Asia empire. The artifact thus leads to the ...",,,5.8,25,Indonesian,Franklin Darmadi,"['Tora Sudiro', 'Irshadi Bagas', 'Indra Birowo', 'Arie Dagienkz', 'Ubay Fox', 'Pierre Gruno', 'Jonathan Ozoh', 'Marsha Timothy', 'Frans Tumbuan', nan, nan, nan, nan, nan, nan]",
Garasi,2006,"Gaia, Aga and Awan only have one goal in their lives: to play music. They formed a band, produced their own mini-album, and distributed it with the support of a local music store. Soon, the...",Drama,,6.2,69,Indonesian,Agung Sentausa,"['Fedi Nuril', 'Ayu Ratna', 'Aries Budiman', 'Desta Club 80s', 'Arie Dagienkz', 'David Tarigan', 'Jajang C. Noer', 'Niniek L. Karim', 'Syaharani', 'Marqie Setianto', 'Denny Sakrie', 'Irwanda Sarumpaet', 'Rivano Setyo Utomo', nan, nan]",110 min
Gotcha,2006,,Horror,,5.1,22,Indonesian,Nayato Fio Nuala,"['Hendrik Betta', 'Kirana Larasati', 'Fikri Ramdhan', 'Maya Septha', 'Arie K. Untung', nan, nan, nan, nan, nan, nan, nan, nan, nan, nan]",
Gue Kapok Jatuh Cinta,2006,,Comedy,,4.5,11,Indonesian,Thomas Nawilis,"['Oka Antara', 'Big Dicky', 'Dude Harlino', 'Hilyani', 'Imelda', 'Sabria Kono', 'Stan Lee', 'Teuku Wisnu', 'Metha Yunatria', nan, nan, nan, nan, nan, nan]",110 min
Hantu Jeruk Purut,2006,"Anna, a horror novelist, found dead at her house after she recorded a ghostlike atmosphere in Jeruk Purut Cemetery. Her best friend, Airin whose dreamed to be a novelist then tries to trace...",Horror,,4.7,54,Indonesian,Nayato Fio Nuala,"['Angie Virgin', 'Sheila Marcia', 'Samuel Zyglwyn', 'Valia Rahma', 'Renny Umari', 'Yulia Widiastuti', 'Ernawati', 'Andrew Roxburgh', 'Ferry Irawan', 'Ahmad Khadaffie', 'Eyya Marnaira', 'Yuni Sulistyowati', nan, nan, nan]",
Heart,2006,"Rachel (Nirina Zubir) is a tomboy girl whose childhood friend is Farel (Irwansyah). This friendship is tested when Farel admits that he has fallen in love with Luna (Acha Septriasa), a feminine girl that makes Rachel wrecked by jealousy.",Drama,17+,6.6,291,Indonesian,Hanny Saputra,"['Nirina Zubir', 'Irwansyah', 'Acha Septriasa', 'Ari Sihasale', 'Rachel Amanda', 'Irshadi Bagas', 'Unique Priscilla', nan, nan, nan, nan, nan, nan, nan, nan]",
Jakarta Undercover,2006,How is Jakarta at midnight? You will find it out in this movie.,Thriller,,6.2,72,Indonesian,Lance Laggong,"['Luna Maya', 'Lukman Sardi', 'Fachry Albar', 'Verdi Solaiman', 'Christian Sugiono', 'Laura Antoinette', 'Kenshiro Arashi', 'Adry Valeri Wens', nan, nan, nan, nan, nan, nan, nan]",
Jatuh Cinta Lagi,2006,A love story between two cynical urban yuppies who have to face each other as lawyers in a courtroom.,Romance,,5.1,11,Indonesian,Rizal Mantovani,"['Gary M. Iskak', 'Krisdayanti', 'Cornelia Agatha', 'Enditha', 'Alex Abbad', 'Bayu Ariotomo', 'Sue Bonnington', 'Daniel Ziv', nan, nan, nan, nan, nan, nan, nan]",
Jomblo,2006,"Four college best friends with their funny lifestyle about college. Met a girl who taught them about love and betrayals, and their life would never be the same again.",Comedy,,7.2,317,Indonesian,Hanung Bramantyo,"['Dennis Adhiswara', 'Rianti Cartwright', 'Rizky Hanggono', 'Karenina Maria', 'Richa Novisha', 'Tike Priatnakusumah', 'Ringgo Agus Rahman', 'Nadya Saphira', 'Christian Sugiono', nan, nan, nan, nan, nan, nan]",
Koper,2006,"Yahya, a low-class employee, finds a suitcase on an empty street. The suitcase is suspected to contain robbed money from a bank. This results in everybody giving the once invisible Yahya ...",Drama,,5.1,15,Indonesian,Richard Oh,"['Anjasmara', 'Joko Anwar', 'Djenar Maesa Ayu', 'Arie Dagienkz', 'Moammar Emka', 'Alberthiene Endah', 'Zen Hae', 'Maya Hasan', 'Indra Herlambang', 'Erry Isfandiari', 'Virnie Ismail', 'Niniek L. Karim', 'Aristides Katopo', 'Butet Kertaradjasa', 'Eka Kurniawan']",
Lentera Merah,2006,"An employee of Lentera Merah, the campus newspaper of the University of Indonesia, is found dead in the office with the number 65 written in blood by his body. In the meantime, five students compete for a position at the publication.",Drama,,6.0,57,Indonesian,Hanung Bramantyo,"['Dimas Beck', 'Laudya Cynthia Bella', 'Firrina', 'Beauty Oehmke', 'Auxilia Paramitha', 'Kartika Indah Pelapory', 'Fikri Ramdhan', 'Tesadesrada Ryza', 'Saputra', 'Teuku Wisnu', nan, nan, nan, nan, nan]",
Maskot,2006,A boy is told by his dying father that he can inherit the family business only if he finds a new chicken mascot for the company's logo printed on the soy sauce bottles. But his quest ...,Comedy,,6.6,22,Indonesian,Robin Moran,"['Uli Auliani', 'Butet Kertaradjasa', 'Epy Kusnandar', 'El Manik', 'Ariyo Wahab', 'Wawan Wanisar', nan, nan, nan, nan, nan, nan, nan, nan, nan]",
Opera Jawa,2006,The story of the performer of Javanese Ramayana human wayang. They are a spouse who lives in a village by selling earthenware products. Conflicts arrived as the husband is going bankrupt and the wife start to looking for another love.,Drama,Not Rated,6.4,398,Indonesian,Garin Nugroho,"['Martinus Miroto', 'Eko Supriyanto', 'Artika Sari Devi', 'Retno Maruti', 'Jecko Siompo Pui', 'I. Nyoman Sura', 'Slamet Gundono', 'Wenang Nggiku', 'Mugiyono', 'Sutanti Sudarso', 'Wahono', 'Sukiatno', 'Dahlan', 'Pawiro Wagimin', 'Subagyo']",
Pesan dari Surga,2006,,Drama,,5.7,34,Indonesian,Sekar Ayu Asmara,"['Luna Maya', 'Vino G. Bastian', 'Ario Bayu', 'Rianti Cartwright', 'Shareefa Daanish', 'Uli Herdinansyah', 'Indah Kalalo', 'Ukka Rizki', 'Lukman Sardi', 'Tino Saroengallo', 'Dimas Seto', 'Ramon Y. Tungka', 'Davina Veronica', 'Cathrine Wilson', 'Madina Wowor']",
Pocong,2006,Wisnu has to witness the brutal slaughter of his family and soon thereafter an evil spirit starts haunting him.,Drama,D,5.6,39,Indonesian,Rudy Soedjarwo,"['Shally Tria Amanda', 'Ronald Kansil', 'Eddie Karsito', 'Kinaryosih', 'Tutie Kirana', 'Dwi Sasono', 'T. Rifnu Wikana', nan, nan, nan, nan, nan, nan, nan, nan]",
Pocong 2,2006,Two sisters find themselves haunted by an evil spirit.,Horror,D,6.5,139,Indonesian,Rudy Soedjarwo,"['Revalina S. Temat', 'Ringgo Agus Rahman', 'Henidar Amroe', 'Agung Basuki', 'Vedie Bellamy', 'Fadiptya Hadi', 'Ronald Kansil', 'Eddie Karsito', 'Otig Pakis', 'Dwi Sasono', 'Risty Tagor', nan, nan, nan, nan]",98 min
"Realita, Cinta, dan Rock n' Roll",2006,Ipang (Vino G. Bastian) and Nugi (Herjunot Ali) are two friends who don't like school. They love to play music and have a dream of becoming rock'n roll musicians. They often skip school to have fun in Sandra's store (Nadine Chandrawinata).,Drama,,6.7,281,Indonesian,Upi Avianto,"['Vino G. Bastian', 'Herjunot Ali', 'Nadine Chandrawinata', 'Barry Prima', 'Shandy Harun', 'Frans Tumbuan', nan, nan, nan, nan, nan, nan, nan, nan, nan]",114 min
