title,year,description,genre,rating,users_rating,votes,languages,directors,actors,runtime
Posesif,2017,"Lala is a platform diving athlete in her final year of high school when she meets Yudhis, a transfer student. The initial romance blossoms, but something about Yudhis is unfolding one by one.",Drama,,7.3,740,Indonesian,Edwin,"['Putri Marino', 'Adipati Dolken', 'Griselda Agatha', 'Chicco Kurniawan', 'Cut Mini Theo', 'Yayu A.W. Unru', 'Ismail Basbeth', 'Maulidina Putri', 'Herlyani Dias Sukmahati', 'Pranarta', 'Iedham Abditama', 'Radit Oza Zakaria', 'Tyas Nurmara', 'Tri Anggoro', 'Adil Ibra']",102 min
Rafathar,2017,Two men try to kidnap a rich family's baby boy who has a superpower named Rafathar.,Adventure,13+,1.4,880,Indonesian,Bounty Umbara,"['Verdi Solaiman', 'Rafathar Malik Ahmad', 'Raffi Ahmad', 'Ence Bagus', 'Babe Cabita', 'Nur Fazura', 'Agus Kuncoro', 'Fred Neust', 'Nagita Slavina', 'Henky Solaiman', 'Arie K. Untung', nan, nan, nan, nan]",91 min
Ruqyah: The Exorcism,2017,This is a true story that happened mid-2012: Mahisa (Evan Sanders) wants to help a movie star named Asha (Celine Evangelista) who feel annoyed by the spirits.,Horror,17+,4.0,65,Indonesian,Jose Poernomo,"['Evan Sanders', 'Celine Evangelista', 'Hikmal Abrar Nasution', 'Mega Carefansa', 'Alfie Alfandi', 'Zahra Jasmine', 'Torro Margens', 'Vinnia Kuntadi', 'Ratu Azalia', 'Reza Keling', nan, nan, nan, nan, nan]",89 min
Satan's Slaves,2017,"After dying from a strange illness that she suffered for 3 years, a mother returns home to pick up her children.",Drama,Not Rated,6.6,"6,877",Indonesian,Joko Anwar,"['Tara Basro', 'Bront Palarae', 'Dimas Aditya', 'Endy Arfian', 'Nasar Annuz', 'M. Adhiyat', 'Arswendi Nasution', 'Egy Fedly', 'Ayu Laksmi', 'Elly D. Luthan', 'Fachry Albar', 'Asmara Abigail', nan, nan, nan]",107 min
Satria Heroes: Revenge of the Darkness,2017,"One year has passed since Satria Garuda Bima-X defeated VUDO and the earth is in peace again. Ray and Rena are rebuilding the Parallel World again. However, new evil forces attack and old enemies rise again to devastate the earth.",Action,13+,3.2,37,Indonesian,Kenzô Maihara,"['Abio Abie', 'Adhitya Alkatiri', 'Stella Cornelia', 'Rayhan Febrian', 'Gackt', 'Nino Kuya', 'Christian Loho', 'Faris Fadjar Munggaran', 'Yayan Ruhian', 'Safira Ratu Sofya', 'Fernando Surya', 'Yui Takano', 'Thalia', nan, nan]",92 min
Satu Hari Nanti,2017,"An anniversary celebration ends badly for a couple, Alya and Bima. The impact does not only affect them but also other couple, Chorina and Din. Two couples who are also best friends trapped...",Drama,21+,6.4,45,Indonesian,Salman Aristo,"['Deva Mahenra', 'Adinia Wirasti', 'Ringgo Agus Rahman', 'Ayushita', 'Luana Fitzgerald', 'Jonas Rüegg', nan, nan, nan, nan, nan, nan, nan, nan, nan]",
Security Ugal-Ugalan,2017,"Acho (Muhadkly Acho), Dana (Sadana Agung), Lolox (Lolox) are Megapolitan Security employees led by Indro Commander (Indro Warkop). Dana falls in love with Angela (Alexa Key). Alan (Dimas ...",Action,,7.9,7,Indonesian,Irham Acho Bahtiar,"['Muhadkly Acho', 'Dimas Beck', 'Alexa Key', 'Lolox', 'Pamela Safitri', 'Henky Solaiman', 'Ovi Sovianti', 'Sadana Agung Sulistya', 'Indro Warkop', nan, nan, nan, nan, nan, nan]",98 min
Sekala Niskala,2017,A young girl seeks out imaginative ways to cope with the death of her twin brother.,Drama,,6.9,298,Indonesian,Kamila Andini,"['Thaly Titi Kasih', 'Ida Bagus Putu Radithya Mahijasena', 'Ayu Laksmi', 'Ketut Rina', 'Happy Salma', 'Ni Gusti Ayu Putu Raka Suryaningsih', nan, nan, nan, nan, nan, nan, nan, nan, nan]",83 min
Si Juki,2017,"Juki is a popular celebrity until one mistake turns him into number one public enemy. But then, a fallen meteor is threatening to destroy Indonesia and a talented young scientist asks Juki's help to stop the meteor together.",Animation,SU,6.4,90,Indonesian,Faza Meonk,"['Muhammad Marzuki', 'Bunga Citra Lestari', 'Faza Meonk', 'Babe Cabita', 'Mongol Stres', 'Wizzy', 'Indro Warkop', 'Pandji Pragiwaksono', 'T.M. Tarsan', 'Butet Kertaradjasa', 'Tio Pakusadewo', 'Mudy Taylor', 'Jaja Mihardja', 'Maya Wulan', 'Agus Kuncoro']",
Silariang the Movie,2017,,Drama,,8.0,27,Indonesian,Wisnu Adi,"['Nurlela M. Ipa', 'Dewi Irawan', 'Bisma Karisma', 'Sese Lawing', 'Muhary Wahyu Nurba', 'Cipta Perdana', 'Andania Suri', nan, nan, nan, nan, nan, nan, nan, nan]",
Stip & Pensil,2017,Four rich high school students try to proof that they are not as arrogant as people in the school talk about.,Comedy,13+,6.7,111,Indonesian,Ardy Octaviand,"['Ernest Prakasa', 'Tatjana Saphira', 'Indah Permatasari', 'Ardit Erwandha', 'Pandji Pragiwaksono', 'Arie Kriting', 'Ghita Bhebhita', 'Iqbal Sinchan', 'Rangga Azof', nan, nan, nan, nan, nan, nan]",98 min
Suhu Beku: The Movie,2017,,Drama,13+,7.7,6,Indonesian,Rusmin Nuryadin,"['Muhammad Nur Fauzan', 'Andi Muhammad Fadli', 'Muhammad Fikri Alif', 'Muhammad Fathur Rachman', 'Nasly Perosyah', 'Falih Ichsan', 'Rifky Prasetya', nan, nan, nan, nan, nan, nan, nan, nan]",88 min
Surat Cinta Untuk Starla the Movie,2017,"Hema has an obsession with nature and always makes a love letter for it. One day, he meets Starla who can make him fall in love. For the first time, he realized that there was a more beautiful love letter that is a love letter for Starla.",Drama,13+,7.0,370,Indonesian,Rudi Aryanto,"['Jefri Nichol', 'Caitlin Halderman', 'Salshabilla Adriani', 'Ricky Cuaca', 'Ramzi', 'Meriam Bellina', 'Mathias Muchus', 'Dian Nitami', 'Rianti Cartwright', 'Kevin Royano', 'Rizky Hanggono', 'Yayu A.W. Unru', 'Teuku Ryzki', 'Erwin Bagindo', 'Amanda Manoppo']",90 min
Surat Kecil Untuk Tuhan,2017,"Two orphan siblings are forced to work as street beggars. One day, an accident lead them to separation. 15 years had passed, one of them is now a successful person, but the past is still haunted them and they decided to find each other.",Drama,R,7.4,121,Indonesian,Fajar Bustomi,"['Bima Azriel', 'Susan Bachtiar', 'Dorman Borisman', 'Kin Wah Chew', 'Ben Joshua', 'Aura Kasih', 'Izzati Khanza', 'Maudy Koesnaedi', 'Bunga Citra Lestari', 'Jeroen Lezer', 'Lukman Sardi', 'Joe Taslim', nan, nan, nan]",
Surau dan Silek,2017,An eleven-year-old boy discovers the true meaning of silek (a martial art) when he meets a 60-year-old retired university teacher and former silek warrior that he is resolved to put an end to his feud with his competitors.,Drama,,8.8,62,Minangkabau,Arief Malinmudo,"['Randu Arini', 'Barry F. Cheln', 'Gilang Dirga', 'Dewi Irawan', 'Bima Jousant', 'Yusril Katil', 'Bintang Khairafi', 'Ricky Komo', 'Muhammad Razi', 'Praz Teguh', nan, nan, nan, nan, nan]",
Surga Yang Tak Dirindukan 2,2017,Sequel to the 2015 film 'Surga Yang Tak Dirindukan'.,Drama,13+,7.1,359,Indonesian,Hanung Bramantyo,"['Laudya Cynthia Bella', 'Fedi Nuril', 'Raline Shah', 'Reza Rahadian', 'Sandrinna Michelle', 'Nora Danish', 'Kemal Palevi', 'Tanta Ginting', 'Muhadkly Acho', 'Andi Keefe Bazli Ardiansyah', 'David Chalik', 'Tasya Medina', 'Vitta Mariana Barrazza', 'Noel Kevas', 'Analies Putri']",121 min
Susah Sinyal,2017,"Ellen does not keep her promise to watch Kiara's performance at the talent show competition between high schools. Kiara is angry and goes to Sumba alone, where she could feel a glimmer of happiness.",Comedy,,7.1,773,Indonesian,Ernest Prakasa,"['Adinia Wirasti', 'Ernest Prakasa', 'Aurora Ribero', 'Refal Hady', 'Valerie Thomas', 'Niniek L. Karim', 'Kin Wah Chew', 'Asri Welas', 'Abdur Arsyad', 'Arie Kriting', 'Gisella Anastasia', 'Gading Marten', 'Dodit Mulyanto', 'Aci Resti', 'Darius Sinathrya']",110 min
Sweet 20,2017,"A 70-year old fussy grandma finds out that her family will send her to a nursing home. In her deeply saddens and devastates, she mysteriously regains her physical appearance from the age of 20.",Comedy,13+,7.3,285,Indonesian,Ody C. Harahap,"['Tatjana Saphira', 'Niniek L. Karim', 'Morgan Oey', 'Kevin Julio', 'Slamet Rahardjo', 'Lukman Sardi', 'Cut Mini Theo', 'Widyawati', 'Alexa Key', 'Tika Panggabean', 'Nina Kozok', 'McDanny', 'Ardit Erwandha', 'Erick Estrada', 'Randhika Jamil']",110 min
The Carousel Never Stops Turning,2017,"This film talks about today's Indonesia from different perspectives economy, politics, arts and culture, society, laws, and history outlined in several fragments influenced by one another.",Drama,,6.8,20,Indonesian,Ismail Basbeth,"['Cornelio Sunny', 'Dhea Ananda', 'Leilani Hermiasih', 'Shalfia Fala Pratika', 'Gandhi Fernando', 'Giras Basuwondo', 'Ibnu Widodo', 'Karina Salim', 'Yan Widjaya', 'Natasha Gott', 'Paul Agusta', 'Rukman Rosadi', 'Sekar Sari', 'Verdi Solaiman', nan]",84 min
The Curse,2017,An expatriate lawyer girl from Indonesia who working in Australia got message from ghost spirit.,Horror,,5.3,19,Indonesian,Muhammad Yusuf,"['Prisia Nasution', 'Shareefa Daanish', 'Lia Waode', nan, nan, nan, nan, nan, nan, nan, nan, nan, nan, nan, nan]",
The Doll 2,2017,"A mother uses her deceased daughter's doll as a medium to communicate with her, but the consequences are chilling.",Horror,,5.4,398,Indonesian,Rocky Soraya,"['Herjunot Ali', 'Luna Maya', 'Sara Wijayanto', 'Maria Sabta', 'Rydhen Afexi', 'Ira Ilva Sari', 'Mega Carefansa', 'Shofia Shireen', 'Wati Sudiyono', 'Princess Martinez', 'Dea Rizkyana', 'Ferdian Ariyadi', 'Syntia', 'Wafa', 'Shandy Aulia']",117 min
The Guys,2017,"Alfi (Raditya Dika) is an employee who works in Mr. Jeremy's (Tarzan) company. He falls in love with his boss' daughter named Amira (Pevita Pearce). Helped by his friends in the office, can Alfi date his boss' daughter or lose his job?",Comedy,13+,6.7,254,Indonesian,Raditya Dika,"['Raditya Dika', 'Pevita Pearce', 'Phongsiree Bunluewong', 'Marthino Lio', 'Indra Jegel', 'Tarzan', 'Widyawati', 'Pimchanok Leuwisetpaiboon', 'Caitlin Halderman', 'Deny Danu Prasetia', nan, nan, nan, nan, nan]",115 min
The Underdogs,2017,4 friends who tried to become famous by being Youtubers.,Comedy,,7.1,63,Indonesian,Adink Liwutang,"['Sheryl Sheinafia', 'Brandon Salim', 'Babe Cabita', 'Jeff Smith', 'Ernest Prakasa', 'Young Lex', 'Han Yoo Ra', 'Dede Yusuf', 'Meira Anastasia', 'Joko Anwar', 'Febby Febiola', 'Dodit Mulyanto', 'Pandji Pragiwaksono', 'Soleh Solihun', 'Aulion']",99 min
"Trinity, The Nekad Traveler",2017,"A career woman from Jakarta named Trinity, who travel to various parts of the world.",Adventure,13+,7.3,61,Indonesian,Rizal Mantovani,"['Maudy Ayunda', 'Hamish Daud', 'Anggika Bolsterli', 'Rachel Amanda', 'Babe Cabita', 'Muhammad Farhan', 'Cut Mini Theo', 'Ayu Dewi', 'Tompi', nan, nan, nan, nan, nan, nan]",103 min
Ular Tangga,2017,An indigo student who can see something bad is going to happen who come through a dream with her plan and friends for hiking a mountain but no one believe her.,Horror,,5.8,33,Indonesian,Arie Azis,"['Ahmad Affandy', 'Alessia Cestaro', 'Shareefa Daanish', 'Egy Fedly', 'Yova Gracia', 'Roy Marten', 'Vicky Monica', 'Fauzan Nasrul', 'Randa Septian', 'Guntur Triyoga', nan, nan, nan, nan, nan]",
Valentine,2017,"Man recruits girl under the guise of making a movie, while really trying to turn her into a masked vigilante.",Action,13+,4.7,504,Indonesian,Ubay Fox,"['Arie Dagienkz', 'Matthew Settle', 'Ahmad Affandy', 'Sasky Aisyawara', 'Indra Birowo', 'Mega Carefansa', 'Albert Cen', 'Amber Lee Connors', 'Cynthia Cranz', 'Hayden Daviau', 'Marcell Domits', 'R. Bruce Elliott', 'Emily Fajardo', 'Stephen Fu', 'Luis Jocom']",105 min
Verses of Love 2,2017,"Fahri, now living in Edinburgh and even becomes a lecturer at University of Edinburgh, but he was forced to live his daily life alone. Together with Uncle Hulusi, his Turkish household assistant, he continued his life without Aisha.",Drama,13+,5.6,533,Indonesian,Guntur Soeharjanto,"['Fedi Nuril', 'Dewi Sandra', 'Chelsea Islan', 'Tatjana Saphira', 'Nur Fazura', 'Pandji Pragiwaksono', 'Arie K. Untung', 'Cole Gribble', 'Dewi Irawan', 'Bront Palarae', 'Timo Scheunemann', 'Melayu Nicole', 'Lera Netesa', 'Millane Fernandez', 'Jihane Almira']",125 min
Wage,2017,"Wage is a biopic movie about the creator of the national anthem of Indonesia titled Indonesia Raya (The Great Indonesia), Wage Rudolf Soepratman.",Biography,,8.8,43,Indonesian,John de Rantau,"['Khoirul Ilyas Aryatmaja', 'Putri Ayudya', 'Herman Bennink', 'Banon Gautama', 'Oim Ibrams', 'Ecky Lamoh', 'Bram Makahekum', 'Ricky H. Malau', 'Prisia Nasution', 'Pandoyo Adi Nugroho', 'Rendra Bagus Pamungkas', 'Richard Pb', 'Eko Petel', 'Kedung Darma R.', 'Ferry Sofyan']",
Warkop DKI Reborn: Jangkrik Boss Part 2,2017,"Dono, Kasino, and Indro's adventure continues. They have to search for the treasure to pay their debts. They travel to Malaysia as their first destination, but the bag with the codes to the treasure is switched with a Malaysian woman's.",Adventure,13+,5.5,404,Indonesian,Anggy Umbara,"['Abimana Aryasatya', 'Vino G. Bastian', 'Tora Sudiro', 'Hannah Al Rashid', 'Indro Warkop', 'Ence Bagus', 'Nur Fazura', 'Nora Danish', 'Babe Cabita', 'Sherry Alhadad', 'Man Raja Lawak', nan, nan, nan, nan]",
3 Srikandi,2016,"Based on a true story. In 1988, Seoul Olympic, 3 female archers from Indonesia created history by winning the first medal ever for the country.",Biography,,6.6,196,Indonesian,Iman Brotoseno,"['Bunga Citra Lestari', 'Chelsea Islan', 'Tara Basro', 'Reza Rahadian', 'Donny Damara', 'Mario Irwinsyah', 'Detri Warmanto', 'Indra Birowo', 'Ivanka Suwandi', 'Joshua Pandelaki', nan, nan, nan, nan, nan]",
Aach... Aku Jatuh Cinta,2016,"A cheerful yet serious Indonesian Romeo and Juliet. A boy and a girl from the same district, but with difficult childhoods and other reasons not to acknowledge their love. Through the ...",Drama,,6.5,51,Indonesian,Garin Nugroho,"['Chicco Jerikho', 'Pevita Pearce', 'Nova Eliza', 'Annisa Hertami', 'Joko Kamto', 'Tony Soekardi', 'Angelista', 'Bima Azriel', 'Gati Andoko', 'Rukman Rosadi', nan, nan, nan, nan, nan]",85 min
Aku Ingin Ibu Pulang,2016,An Indonesian drama following the life of a young marathon runner who just wants his mother to return and make their family whole again.,Drama,SU,8.0,6,Indonesian,Monty Tiwa,"['Jefan Nathanio', 'Nirina Zubir', 'T. Rifnu Wikana', 'Ghecca Tavvara', 'Verdi Solaiman', 'Mario Irwinsyah', 'Nova Eliza', 'Deddy Mahendra Desta', 'Acha Sinaga', 'Reza Nangin', 'Andy F. Noya', nan, nan, nan, nan]",101 min
Algojo: Perang Santet,2016,"Desta was born in the happy family. However, happiness in the family did not last long when a shipment of witchcraft led to the death of both parents. Desta grow up to be a loner and full ...",Action,,1.6,49,Indonesian,Rudy Soedjarwo,"['Darius Sinathrya', 'Stevie Domminique Jollie', 'Otig Pakis', 'Christoffer Nelwan', 'Emil Kusumo', 'Wani Siregar', 'Galih Galinggis', 'Sabrina Athika', 'Osh Indah', 'Siska Sandy', 'Betet Kunamsinam', 'Kim Kematt', 'Andi Bersama', 'Aulia Mahariza', nan]",94 min
Bangkit!,2016,,Action,13+,6.4,14,Indonesian,Rako Prijanto,"['Putri Ayudya', 'Vino G. Bastian', 'Donny Damara', 'Adrian Dima', 'Khiva Iskak', 'Yasamin Jasem', 'Deva Mahenra', 'Ferry Salim', 'Acha Septriasa', 'Yayu A.W. Unru', nan, nan, nan, nan, nan]",
Bulan Terbelah di Langit Amerika 2,2016,"When Hanum and Rangga decided to return to Vienna, Hanum's boss gave them a new mission: to find a treasure left behind by a group of Chinese Muslim sailors who had set their sail toward the American continent long before Columbus arrived.",Adventure,13+,4.4,153,Indonesian,Rizal Mantovani,"['Acha Septriasa', 'Abimana Aryasatya', 'Nino Fernandez', 'Rianti Cartwright', 'Hannah Al Rashid', 'Ira Wibowo', 'Hailey Franco', 'Boy William', 'Kenny Adianto Putra', 'Adlu Fahrezi', 'Eko Susilo', 'Rudianto Fransiskus', 'Novi Sandra Sari', 'Astro Liecharlie', 'Thomas Johansen']",100 min
Catatan Dodol Calon Dokter,2016,"The struggle of a young doctor-to-be in finding his true calling while dealing with romance and friendship as a ""ko-ass"" or pre-med.",Comedy,,6.6,52,Indonesian,Ifa Isfansyah,"['Amec Aris', 'Tika Bravani', 'Adipati Dolken', 'Gito Gilas', 'Albert Halim', 'Donna Harun', 'Adi Kurdi', 'Torro Margens', 'Ali Mensan', 'Rizky Mocil', 'Aurélie Moeremans', 'Ikke Nurjanah', 'Rizka Dwi Septiana', 'Cindy Valerie', 'Ingrid Widjanarko']",103 min
Cek Toko Sebelah,2016,"Right when everything is going well for Erwin, his father falls sick and asks him to drop everything and help out at the family store disappointing Yohan, his irresponsible older brother.",Comedy,13+,8.0,"1,472",Indonesian,Ernest Prakasa,"['Ernest Prakasa', 'Kin Wah Chew', 'Gisella Anastasia', 'Dion Wiyoko', 'Adinia Wirasti', 'Dodit Mulyanto', 'Tora Sudiro', 'Adjis Doaibu', 'Andi Awwe Wijaya', 'Arafah Rianti', 'Yeyen Lydia', 'Anyun Cadel', 'Hernawan Yoga', 'Ghita Bhebhita', 'Budi Dalton']",104 min
Cinta Laki-Laki Biasa,2016,"Nania (Velove Vexia) who comes from a rich family falls in love with Rafli (Deva Mahenra), an ordinary man. They were opposed by Nania's mother. Their love was tested by various trials.",Drama,,7.9,34,Indonesian,Guntur Soeharjanto,"['Velove Vexia', 'Deva Mahenra', 'Nino Fernandez', 'Cok Simbara', 'Ira Wibowo', 'Dewi Yull', 'Dini Aminarti', 'Muhadkly Acho', 'Agus Kuncoro', 'Dewi Rezer', 'Uli Herdinansyah', 'Fanny Fabriana', 'Adi Nugroho', 'Donita', 'Mellya Baskarani']",
Comic 8: Casino Kings Part 2,2016,"Eight secret agents are led into a trap by ""The King"" and the army. The secret agents must bet on their lives in the world's largest online gambling scheme whose players include renowned gamblers from around the globe.",Action,13+,6.1,307,Indonesian,Anggy Umbara,"['Hannah Al Rashid', 'Donny Alamsyah', 'Ence Bagus', 'Babe Cabita', 'Candil', 'Billy Chong', 'Adjis Doaibu', 'Fico Fachriza', 'Gandhi Fernando', 'Agung Hercules', 'Lydia Kandou', 'Arie Kriting', 'Agus Kuncoro', 'Sophia Latjuba', 'Cak Lontong']",
Dear Love,2016,"A story between Rayya (Mentari de Marelle) and Nico (Dimas Aditya) who have been a very close best friend since they were kids. But as time goes by, they realize that they fall in love each other.",Romance,,7.2,15,Indonesian,Dedy Syah,"['Dimas Aditya', 'Billy Davidson', 'Mentari De Marelle', 'Eza Giunino', 'Rebecca Tamara', nan, nan, nan, nan, nan, nan, nan, nan, nan, nan]",105 min
Emma' (Mother),2016,"Athirah's life is shattered when another woman enters her husband's life. In a time and cultural background where polygamy is still widely accepted, Athirah struggles alone with the hurt and humiliation.",Drama,,7.1,109,Indonesian,Riri Riza,"['Cut Mini Theo', 'Christoffer Nelwan', 'Nino Prabowo', 'Arman Dewarti', 'Indah Permatasari', 'Tika Bravani', 'Jajang C. Noer', 'Dimi Cindyastira', 'Irmawati Jabbar', 'Andreuw Parinussa', nan, nan, nan, nan, nan]",77 min
Firegate,2016,The oldest pyramid in the world is found in Indonesia. A journalist must team up with an archaeologist and a shaman to uncover the mystery of the pyramid. They found out that this ancient pyramid is a prison for a malevolent ancient demon.,Adventure,,6.5,98,Indonesian,Rizal Mantovani,"['Julie Estelle', 'Reza Rahadian', 'Ray Sahetapy', 'Dwi Sasono', nan, nan, nan, nan, nan, nan, nan, nan, nan, nan, nan]",113 min
Hangout,2016,Nine people who were invited to a mysterious island tried to survive when someone began to murder them one by one.,Comedy,13+,5.9,564,Indonesian,Raditya Dika,"['Raditya Dika', 'Soleh Solihun', 'Prilly Latuconsina', 'Gading Marten', 'Titi Kamal', 'Surya Saputra', 'Dinda Kanyadewi', 'Bayu Skak', 'Mathias Muchus', nan, nan, nan, nan, nan, nan]",101 min
Headshot,2016,"Uwais plays a young man who washes ashore, an amnesiac with a serious head injury whose past comes back to haunt him shortly after being nursed back to health by a young doctor. Violence ensues. Sweet, sweet violence.",Action,Not Rated,6.3,"12,507",Indonesian,Kimo Stamboel,"['Iko Uwais', 'Chelsea Islan', 'Sunny Pang', 'Very Tri Yulisman', 'Julie Estelle', 'Ario Bayu', 'Yayu A.W. Unru', 'Ganindra Bimo', 'Egy Fedly', 'Hirooki Goto', 'Gusti Achmad Habibi', 'David Hendrawan', 'Epy Kusnandar', 'Zack Lee', 'Udeh Nans']",118 min
I Am Hope,2016,"Mia is a writer who's very eager to make her own play with her musician father, Raja Abdinegara, until that very dream halts due to her newly found lung cancer, the same disease that once ...",Drama,,7.2,12,Indonesian,Adilla Dimitri,"['Tatjana Saphira', 'Fachry Albar', 'Ray Sahetapy', 'Febby Febiola', 'Alessandra Usman', 'Fauzi Baadila', 'Sandra Dewi', 'Ine Febriyanti', 'Wulan Guritno', 'Sophia Latjuba', 'Prisia Nasution', 'Aming Sugandhi', 'Deddy Sutomo', 'Ariyo Wahab', 'Khairan Aldy']",115 min
ILY from 38.000 Ft,2016,"Aletta (Michelle Ziudith) meets Arga (Rizky Nazar) in Bali and they fall head over heels in love. They spent every moment together. When they return to Jakarta, Arga promises to find her and marry her. But, he never shows up anymore.",Drama,,6.0,111,Indonesian,Asep Kusdinar,"['Michelle Ziudith', 'Rizky Nazar', 'Tanta Ginting', 'Derby Romero', 'Amanda Rawles', 'Ricky Cuaca', 'Ayu Dyah Pasha', 'Aline Tumbuan', 'Ira Wibowo', 'Amaranggana', 'Rizky Hanggono', 'Lionil Hendrik', 'Eko Mulyadi', 'Verrell Bramasta', nan]",102 min
Indera ke Enam,2016,"Merry and her daughter, Dina, decided to organize their lives by moving to a small house. But the situation that went well changed drastically when he began to look again at the occult.",Thriller,,5.8,18,Indonesian,Wisnu Kuncoro,"['Natasha Gott', 'Widi Dwinanda', 'Gandhi Fernando', nan, nan, nan, nan, nan, nan, nan, nan, nan, nan, nan, nan]",77 min
Ini Kisah Tiga Dara,2016,"Since their mother passed away, three siblings known as Tiga Dara were taken by their father to the east of Flores, to a small seaside town. They built a beautiful boutique hotel, continuing their mother's dream.",Drama,,6.7,40,Indonesian,Nia Di Nata,"['Titiek Puspa', 'Shanty Paredes', 'Tara Basro', 'Tatyana Akman', 'Rio Dewanto', 'Reuben Elishama', 'Richard Kyle', 'Ray Sahetapy', 'Cut Mini Theo', 'Joko Anwar', 'Nicke Vinadia', nan, nan, nan, nan]",124 min
Iseng,2016,"Inspired by a true story about a young rookie detective paired with an experienced officer, a flirtatious secretary, a prostitute, three thugs, a driver, a restaurant owner, a cook, and a ...",Drama,D,7.0,22,Indonesian,Adrian Tang,"['Donny Alamsyah', 'Viola Arsa', 'Ayushita', 'Fauzi Baadila', 'Siti Badriah', 'Manda Cello', 'Fandy Christian', 'Melinda Csm', 'Donny Damara', 'Wulan Guritno', 'Khiva Iskak', 'Micheal Kho', 'Evelinn Kurniadi', 'Nagra Kautsar Pakusadewo', 'Tio Pakusadewo']",100 min
Istirahatlah Kata-Kata,2016,"Wiji Thukul, a well-known poet, is designed as a suspect activist. With the police looking for him, Wiji is forced to leave Solo for Borneo, thousands of kilometers away.",Adventure,D,7.3,217,Indonesian,Yosep Anggi Noen,"['Gunawan Maryanto', 'Marissa Anita', 'Eduward Manalu', 'Melanie Subono', 'Davi Yunan', 'Franco Christo', 'Kun Hidayat', 'Mugiono', 'Arswendi Nasution', 'Putri Fathiya Hany Nurrohman', 'Edwin Setiadi Raharja', 'Rukman Rosadi', 'Arif Setiawan', 'Sucipto', 'Joned Suryatmoko']",97 min
Jagoan Instan,2016,"Bumi then becomes Instant Champ, who has strength and superiority after being injected with the serum. When the serum disappears, Bumi is back into a mediocre man.",Action,SU,5.3,23,Indonesian,Fajar Bustomi,"['Kemal Palevi', 'Kevin Julio', 'Anisa Rahma', 'Dede Yusuf', 'Meriam Bellina', 'Alexa Key', 'Jovial Da Lopez', 'Andovi Da Lopez', 'Ki Manteb Soedharsono', 'Daan Aria', 'Faras Fatik', 'Nikita Mirzani', 'Maxx Don', 'Mo Sidik', 'Fico Fachriza']",96 min
Jilbab Traveler: Love Sparks in Korea,2016,"Rania Samudra (Bunga Citra Lestari) is a travel writer and nicknamed Jilbab Traveler by the readers. When her father was sick, Rania decided to go home. But her father does not want her to worry and keep asking to continue her journey.",Drama,,6.9,14,Indonesian,Guntur Soeharjanto,"['Bunga Citra Lestari', 'Morgan Oey', 'Giring Ganesha', 'Ringgo Agus Rahman', 'Wawan Wanisar', 'Dewi Yull', 'Tasya Medina', 'Indra Bekti', 'Ferry Ardiansyah', 'Aldila Jelita', nan, nan, nan, nan, nan]",112 min
Jingga,2016,,Drama,,7.0,7,Indonesian,Lola Amaria,"['Ray Sahetapy', 'Keke Soeryo', 'Joshua Pandelaki', 'Hifzane Bob', 'Quasar H.Y.', 'Hany Valerie', 'Aufa Assagaf', 'Nina Tamam', 'Isa Raja Loebis', nan, nan, nan, nan, nan, nan]",102 min
Juara,2016,,Action,,6.0,6,Indonesian,Charles Gozali,"['Bisma Karisma', 'Ciccio Manassero', 'Cecep Arif Rahman', 'Tora Sudiro', 'Cut Mini Theo', nan, nan, nan, nan, nan, nan, nan, nan, nan, nan]",106 min
Ketika Mas Gagah Pergi the Movie,2016,"Gagah was changed. After went to Ternate for his assignment suddenly, he changed drastically. His sister, Gita Ayu can't accept this. She thought Gagah is a new person who totally different from the previous one.",Drama,SU,8.3,67,Indonesian,Firman Syah,"['Hamas Syahid', 'Aquino Umar', 'Masaji Wijayanto', 'Izzah Ajrina', 'Muhammad Taufik Akbar', 'Kholidi Asadil Alam', 'Ilham Anas', 'Endy Arfian', 'Abdurrahim Arsyad', 'Faisal Azhar', 'Muhammad Bagya', 'Andy Birulaut', 'Maxime Bouttier', 'Fendy Chow', 'Mentari De Marelle']",
Koala Kumal,2016,"Dika's marriage is got canceled because his girlfriend is cheating on him. After a long time broken heart, he met Trisna, a girl with a unique viewpoint. Trisna was trying to make Dika get over heartbreak and told him to revenge his ex.",Comedy,,6.6,449,Indonesian,Raditya Dika,"['Raditya Dika', 'Acha Septriasa', 'Sheryl Sheinafia', 'Nino Fernandez', 'Ernest Prakasa', 'Cut Mini Theo', 'Dede Yusuf', 'Dwi Sasono', 'Anggika Bolsterli', 'Fero Walandouw', 'Adipati Dolken', 'Kevin Julio', 'Jessica Mila', 'Lydia Kandou', 'Kevin Anggara']",
Kurung Manuk (Bird Cage),2016,Manuk an overly imaginative man child who never leaves his bedroom who ends up not only becoming the black sheep of the neighborhood but also the prime suspect of a serial murder case.,Sci-Fi,,7.2,11,Indonesian,Sigit Pradityo,"['Mehdi Amrullah', 'Asep', 'Sabrina Athika', 'Adhie August', 'Meike Djuaeni', 'Yohanes Dwicipta', 'Andre Bablo Fardanish', 'Faras Fatik', 'Adinda Gabby', 'Gonzalo Gomez Pidal', 'Arie Gusti', 'Prasajadi Heru', 'Osh Indah', 'Citra Lubis', 'Makoto']",
